餐厅名,种类,地址,评分,人均,链接
湾区九号潮汕牛肉火锅,火锅,香洲区情侣南路287号,5,44,https://www.meituan.com/meishi/1742127993/
蒙肥羊自助餐厅（香洲店）,火锅,香洲区凤凰南路1130号马可波罗大厦2楼（吉之岛旁，肯德基楼上）,5,54,https://www.meituan.com/meishi/1238743/
金记猪肚鸡复合型餐厅,火锅,香洲区香洲区侨光路5号华策大厦2楼,5,75,https://www.meituan.com/meishi/1238657/
哈儿土火锅（拱北旗舰店）,火锅,香洲区水湾路情侣南路288号,4.4,56,https://www.meituan.com/meishi/191158837/
海鸿鲜蒸煮题餐厅（夏湾店）,火锅,香洲区昌平路春泽名园288、290、292号铺（老川坊对面）,5,15,https://www.meituan.com/meishi/50659794/
菌味香云南野生菌主题餐厅,火锅,香洲区香洲银桦路652号（新加坡花园1期门口）,5,88,https://www.meituan.com/meishi/5896736/
永兴生蚝火锅店（拱北店）,火锅,香洲区水湾路87、89、91号,5,16,https://www.meituan.com/meishi/195600359/
水禾轩·蒸汽主题餐厅（新香洲店）,火锅,香洲区红山路163号体育中心南门A区三号,5,95,https://www.meituan.com/meishi/40786293/
金众记猪肚鸡（景山路店）,火锅,香洲区吉大景山路94号（凌波酒店对面）,4.7,56,https://www.meituan.com/meishi/1238453/
锦州烧烤·灌县老妈砂锅串串,火锅,香洲区心华路152号-1（广富市场对面）,4.7,61,https://www.meituan.com/meishi/166615908/
金众记猪肚鸡（南屏店）,火锅,香洲区环屏路8号楼5号铺,4.5,31,https://www.meituan.com/meishi/42653359/
同仁四季音乐主题餐厅（珠海拱北店）,火锅,香洲区桂花南路122号城市客栈酒店一楼,4.4,59,https://www.meituan.com/meishi/160118514/
豆捞坊,火锅,香洲区前山所前山旅游路168号梅溪商业广场奥园广场二期第L3层L3-07号商铺,5,72,https://www.meituan.com/meishi/193140228/
魅力牛香·牛杂火锅（南屏旗舰店）,火锅,香洲区南湾北路45号南屏商业中心1F001、1F032号铺（弘桥商城侧）（南屏大桥巴士站右侧）,4.7,61,https://www.meituan.com/meishi/40097464/
润鼎四季（吉大店）,火锅,香洲区吉大景山路96号(近吉大市场),4.5,58,https://www.meituan.com/meishi/42374645/
三头牛·鲜牛肉火锅（夏湾店）,火锅,香洲区粤华路327号（中国农业银行对面）,4.7,44,https://www.meituan.com/meishi/160415013/
味缘·磨磨香（富华里店）,火锅,香洲区九洲大道西2033号中海富华里2栋2-02,4.4,75,https://www.meituan.com/meishi/64843470/
三宝,火锅,香洲区银桦路727号（体育中心东门对面）,4.9,54,https://www.meituan.com/meishi/6054931/
濠轩阁特色生蚝火锅（新市花园总店）,火锅,香洲区粤华路152号新市花园（泰锋电器与初心烧鹅中间巷子）,4.7,56,https://www.meituan.com/meishi/112309232/
菌香园（吉大旗舰店）,火锅,香洲区九洲大道东1197号凯迪克酒店2楼中餐厅,4.5,15,https://www.meituan.com/meishi/1238867/
汕头八合里海记牛肉火锅店（扬名分店）,火锅,香洲区凤凰南路1060号1楼（扬名广场二期锦江之星酒店1楼）,4.4,88,https://www.meituan.com/meishi/50967275/
渝城四季老火锅,火锅,香洲区围基路24号二、三楼,3.8,95,https://www.meituan.com/meishi/193888934/
共乐驿站·乡村stlye蒸汽主题餐厅,火锅,香洲区山房路94号（玲珑咖啡后面）,5,16,https://www.meituan.com/meishi/42133280/
尚品轩,火锅,香洲区夏湾路171-175号（近港昌路）,4.5,56,https://www.meituan.com/meishi/2755972/
港式1号打边炉,火锅,香洲区桂花南路北桂花南路88号,4.4,61,https://www.meituan.com/meishi/195149897/
五饼二鱼·原味蒸汽火锅（香洲店）,火锅,香洲区洲山路23号综合楼（锦江之星）,4.5,31,https://www.meituan.com/meishi/40352298/
湘乡小厨（富华里店）,火锅,香洲区九洲大道西2033号中海富华里11栋2-03,4.6,59,https://www.meituan.com/meishi/42420885/
蓝波斯菊鲜汤火锅（日月贝店）,火锅,香洲区渔湾路29号城建海韵城A区二层L2-8号（近日月贝）,4.2,72,https://www.meituan.com/meishi/150344350/
小镇牛杂,火锅,香洲区南屏镇环屏路24号C栋一层A8、A9号商铺,5,58,https://www.meituan.com/meishi/41993295/
渝都川菜火锅（夏湾店）,火锅,香洲区夏湾侨光西路310号（华骏大酒店对面）,4.3,61,https://www.meituan.com/meishi/1235847/
小锅盖粥城,火锅,香洲区明珠南路1137号,5,44,https://www.meituan.com/meishi/182724476/
德兴show鲜·蒸汽海鲜火锅餐厅（体育中心店）,火锅,香洲区红山路163号体育中心南门,4.5,75,https://www.meituan.com/meishi/41722728/
重庆杜家火锅,火锅,香洲区拱北迎宾南路华侨宾馆正对面（近街边公园，华侨宾馆巴士站旁边）,4.4,54,https://www.meituan.com/meishi/2213975/
腩潮鲜牛腩火锅,火锅,香洲区南屏镇环屏路16号BOX创意区1016/1028#商铺,4.6,56,https://www.meituan.com/meishi/193611998/
新重庆川菜火锅酒楼（莲花店）,火锅,香洲区莲花路18号汽车总站来魅力商场二楼,4.3,15,https://www.meituan.com/meishi/5329066/
金成记猪肚鸡（凤凰北店）,火锅,香洲区华海路70号（华润万家往海边200米左侧、华海花园小区正门对面）,4.3,88,https://www.meituan.com/meishi/41218579/
海诚记海鲜牛肉火锅,火锅,香洲区景山路63号,3.5,95,https://www.meituan.com/meishi/1450275013/
淼福猪肚鸡（井岸店）,火锅,斗门区中兴中路31号（银城公交站旁）,4.1,16,https://www.meituan.com/meishi/65369713/
润泽园海南椰子鸡（拱北店）,火锅,香洲区迎宾南路2064号（华侨宾馆旁）,3.7,56,https://www.meituan.com/meishi/2528519/
王太爷牛蛙恋湘鱼（前山直营店）,火锅,香洲区珠海香洲区前山明珠南路1159号（诚丰广场与华润万家之间）,4.2,61,https://www.meituan.com/meishi/1667795989/
黄记煌三汁焖锅（国贸店）,火锅,香洲区吉大景山路228号国贸购物广场一层G-2A、G-2B,3.8,31,https://www.meituan.com/meishi/42434667/
金湾食王（湾仔海鲜街店）,火锅,香洲区湾仔海鲜街18号,3.9,59,https://www.meituan.com/meishi/2214780/
串掌门砂锅串串香（唐家店）,火锅,香洲区唐乐路30号（海悦居底商铺）,4.4,72,https://www.meituan.com/meishi/182378638/
卓卓有渔顺德私房菜,火锅,香洲区柠溪所柠溪路489号2楼（重庆山城二楼）,4.1,61,https://www.meituan.com/meishi/42252074/
千打牛肉丸,火锅,香洲区唐家文化广场福乐购百货一楼（唐家综合市场）,3.8,58,https://www.meituan.com/meishi/40431062/
串掌门砂锅串串香（唐家店）,火锅,香洲区唐乐路30号（海悦居底商铺）,4.4,44,https://www.meituan.com/meishi/182378638/
牛一锅·牛肉火锅,火锅,香洲区吉大九洲大道东绿茵豪庭楼下老树咖啡旁,4,54,https://www.meituan.com/meishi/6989979/
赞记美食,火锅,香洲区港一路29号（南苑小区处，铂金假日酒店斜对面）,3,75,https://www.meituan.com/meishi/51505425/
海汕牛肉火锅,火锅,香洲区南屏屏东六路78号商铺,3.5,56,https://www.meituan.com/meishi/1876638967/
香辣跳跳蛙,火锅,香洲区银桦路630号（金桦花园巴士站后面）,3.9,15,https://www.meituan.com/meishi/1240924/
大厨小盏,火锅,香洲区上华路1号（中珠上城会所一楼）,3.9,88,https://www.meituan.com/meishi/41048140/
亚游牛杂大王,火锅,香洲区侨光路409号（华发国际花园商铺）,3.7,95,https://www.meituan.com/meishi/185410161/
华富美食大排档,火锅,香洲区粤华路225号《花苑新村11栋》可高德导航华富美食,3.5,16,https://www.meituan.com/meishi/6043655/
润鼎四季（富华里店）,火锅,香洲区九洲大道西2033号中海富华里7栋2-01,3.8,56,https://www.meituan.com/meishi/41598156/
澳门一家春海鲜火锅,火锅,香洲区情侣南路489号九洲花园东门处（九洲港货柜码头对面）,4.7,61,https://www.meituan.com/meishi/1536374/
牛回全牛美食（珠海店）,火锅,香洲区翠微西路392号铺,3.5,31,https://www.meituan.com/meishi/2214439/
东来顺饭庄（吉大店）,火锅,香洲区情侣南路453号(近九州花园正门),4,59,https://www.meituan.com/meishi/1237518/
老字号歪记驰名澳门骨煲,火锅,香洲区粤华路与关闸中街中街交叉口昌隆五金交电正对面（近莲花路昌安酒店停车场）,3.5,72,https://www.meituan.com/meishi/2805048/
冯鱼头火锅,火锅,香洲区情侣南路青蓝山庄348号,4.4,61,https://www.meituan.com/meishi/1235957/
品点蒸艺餐厅,火锅,香洲区翠海路124号（扬名广场后面）,3.7,58,https://www.meituan.com/meishi/42694229/
顺德醉鹅广西牛杂煲,火锅,斗门区工业大道25号（新廖记食店正对面，新鸿酒店斜对面）,4.1,44,https://www.meituan.com/meishi/2215554/
祥祺酒店豪宴酒楼,火锅,金湾区金湾路1号祥祺酒店三楼,3.9,75,https://www.meituan.com/meishi/6201327/
宁城驴庄,火锅,香洲区梅溪市场首层商铺（梅溪牌坊旁边）,4.3,54,https://www.meituan.com/meishi/6501819/
海记石锅鱼,火锅,香洲区拱北水湾路157号（金百合对面）,3.8,56,https://www.meituan.com/meishi/42528001/
嘿 串串九宫格火锅,火锅,香洲区香洲拱北粤华路73号（莲花路春尚酒店旁500）,4.5,88,https://www.meituan.com/meishi/41522662/
金成记猪肚鸡（888美食街店）,火锅,香洲区银桦路888街92号,3.5,15,https://www.meituan.com/meishi/40998673/
森哥美食海鲜火锅（侨光路店）,火锅,香洲区侨光西路245号,3.9,95,https://www.meituan.com/meishi/41523358/
回味鲜猪肚鸡,火锅,斗门区井岸镇井湾路169号,4.1,16,https://www.meituan.com/meishi/50498278/
湛府羊火锅,火锅,香洲区心华路132号,4.1,56,https://www.meituan.com/meishi/63410228/
汕头鲜牛肉火锅,火锅,香洲区中盛路47号,4.5,61,https://www.meituan.com/meishi/52840589/
魅力牛香（官塘店）,火锅,香洲区金鼎官塘商业街12号商铺（盛壹超市官塘店旁）,4.4,31,https://www.meituan.com/meishi/42887801/
乡村小园,火锅,斗门区珠峰大道东风广场旁（原添成庄园）,3.7,59,https://www.meituan.com/meishi/5878905/
花苑美食海鲜生蚝火锅,火锅,香洲区粤华路225号（花苑新村5幢）,3.4,72,https://www.meituan.com/meishi/2214284/
多福记猪肚鸡（井岸店）,火锅,斗门区尖峰前路330号（康盛花园处）,4,58,https://www.meituan.com/meishi/6760951/
长润牛羊坊（新香洲店）,火锅,香洲区香华路401号（新加坡花园2-3期门口）（十九小学旁）,3.9,61,https://www.meituan.com/meishi/1239535/
柳叶湖石锅鱼万州烤鱼（金湾店）,火锅,金湾区红旗镇南翔路柠檬印象90-92号（农商银行旁）,4.4,44,https://www.meituan.com/meishi/4734291/
味禾猪肚鸡石锅鱼,火锅,香洲区唐家综合市场49-50卡,4.5,75,https://www.meituan.com/meishi/42064528/
金品记猪肚鸡酒楼（拱北总店）,火锅,香洲区粤海中路2300号丽枫酒店一楼（原四海酒店）,3.8,54,https://www.meituan.com/meishi/1239914/
潮阳老七牛肉火锅（珠海总店）,火锅,香洲区紫荆路359号（紫荆园巴士站后）,4,56,https://www.meituan.com/meishi/63582273/
豆捞坊（华发商都店）,火锅,香洲区珠海大道8号华发商都C馆2层,3.8,15,https://www.meituan.com/meishi/40457924/
黄记煌三汁焖锅（茂业百货店）,火锅,香洲区紫荆路301号茂业百货六楼(香洲总站对面),3.7,88,https://www.meituan.com/meishi/62842313/
嘎嘎香东北菜,火锅,香洲区怡华街72号（近体育中心西门，富康花园美食街）,4,95,https://www.meituan.com/meishi/2214064/
巴蜀人家（鞍莲路店）,火锅,香洲区鞍莲8号大鹏酒店1-2楼（前山政府对面）,4.4,16,https://www.meituan.com/meishi/2837083/
罗记皇鸽餐厅（红旗店）,火锅,金湾区广安路26号,3.7,56,https://www.meituan.com/meishi/69273066/
钟鱼来了鱼火锅（官塘店）,火锅,香洲区唐家湾镇金唐西路官塘陶园新村12号（北理北门对面，百世汇通快递旁）,4.2,61,https://www.meituan.com/meishi/42790928/
尚品捞火锅茶餐厅,火锅,香洲区湾仔中盛路42号（建设银行对面）,3.9,31,https://www.meituan.com/meishi/41409474/
渔和虾,火锅,香洲区怡华街38号,4.8,59,https://www.meituan.com/meishi/42219637/
皇鸽餐厅,火锅,香洲区明珠南路1125号（明珠商业广场前300米）,4.5,72,https://www.meituan.com/meishi/71564124/
淼福猪肚鸡（拱北店）,火锅,香洲区侨岭街30号原伙工殿（迎商宾馆楼下）,4.2,58,https://www.meituan.com/meishi/74021175/
老地方养生板栗鸡,火锅,金湾区三灶镇安堂村商业街三期1楼C1-08铺,4.3,61,https://www.meituan.com/meishi/41399011/
蛙国演义（柠溪店）,火锅,香洲区柠溪路240号（上岛咖啡旁）,3.9,44,https://www.meituan.com/meishi/70900/
德顺轩粥底火锅城,火锅,香洲区情侣南路362号（近九州港）,4.5,75,https://www.meituan.com/meishi/1240551/
大自然农庄,火锅,斗门区黄杨大道与工业大道西行100米（近井岸二桥，高速底下）,3.8,54,https://www.meituan.com/meishi/6634718/
黄记煌三汁焖锅（华发商都店）,火锅,香洲区珠海大道8号华发商都B馆2号楼2层B2023b,3.6,56,https://www.meituan.com/meishi/6223345/
三顾冒菜（茂业百货店）,火锅,香洲区紫荆路301号6楼601A-03商铺,3.4,88,https://www.meituan.com/meishi/51595538/
四川简阳原汤羊肉火锅,火锅,香洲区翠珠三街1号（翠微电脑城后）,4.5,15,https://www.meituan.com/meishi/4921222/
翠源茶楼,火锅,香洲区翠微西路668号,3.5,95,https://www.meituan.com/meishi/40640390/
胜海东山羊庄,火锅,香洲区迎宾北路1065号帝濠度假酒店旁,5,16,https://www.meituan.com/meishi/4118098/
尚记老羊倌,火锅,香洲区情侣南路328号（青蓝山庄食街处）,5,56,https://www.meituan.com/meishi/1237792/
麻辣英雄重庆老火锅（夏湾店）,火锅,香洲区夏湾路19号（夏湾市场对面）,5,61,https://www.meituan.com/meishi/69894749/
牛福诚冒菜,火锅,金湾区美平东路1232号,4.1,31,https://www.meituan.com/meishi/69604120/
李世霸王牛肉火锅主题餐厅（珠海店）,火锅,香洲区金鸡路左右创意园内,4,59,https://www.meituan.com/meishi/65361425/
龙坛山庄,火锅,斗门区龙西村港霞西路龙坛水淋泵2号（即实验中学旁龙坛村口）,4.7,72,https://www.meituan.com/meishi/2536087/
赣香猪肚鸡火锅,火锅,金湾区金岛路205号（金海岸中学对面）,4,58,https://www.meituan.com/meishi/2215475/
重庆石锅鱼（兰埔店）,火锅,香洲区兰埔路125号（兰埔郵政银行正对面）,4,61,https://www.meituan.com/meishi/4624532/
海记潮汕鲜牛肉火锅,火锅,金湾区金海岸购物广场一楼（金海岸市场东车站旁）,3.5,44,https://www.meituan.com/meishi/195155191/
水禾轩·原汁原味蒸出健康（山场店）,火锅,香洲区银桦路178号11-16号商铺,4.1,75,https://www.meituan.com/meishi/167408397/
粥当家,火锅,香洲区紫荆路98号,3.4,54,https://www.meituan.com/meishi/195923803/
贝哥卜卜贝海鲜火锅,火锅,金湾区590县道中安街二巷24号,3.5,56,https://www.meituan.com/meishi/858417065/
六乘六私房重庆老火锅,火锅,金湾区北河一路傲视影城旁边158号铺,5,15,https://www.meituan.com/meishi/113277221/
清鲜阁四季养生火锅城,火锅,金湾区平沙镇聚然居3号2栋B201（邮政储蓄银行二楼）,3,88,https://www.meituan.com/meishi/169003434/
藏青蓝全牛宴,火锅,香洲区翠微西路688号（嘉园公交站对面）,0,95,https://www.meituan.com/meishi/938046773/
牛一道（井岸店）,火锅,斗门区滨江路140号,3.5,16,https://www.meituan.com/meishi/1019143283/
顺德福·牛花粥（前山店）,火锅,香洲区翠福路8号清华十二郡西门对面,3.8,56,https://www.meituan.com/meishi/169382570/
爱鱼者（奥园广场店）,火锅,香洲区奥园广场SY5–204,4.5,61,https://www.meituan.com/meishi/1665003290/
名门潮牛潮汕牛肉火锅全国专门店（诚丰店）,火锅,香洲区明珠南路诚丰广场2楼L208A-L209B,4,31,https://www.meituan.com/meishi/99985876/
罗一手四季牛肉火锅,火锅,斗门区井岸镇江湾一路119号（中国人民保险旁）,4.1,59,https://www.meituan.com/meishi/175134929/
熙藏传奇石锅鸡（香洲店）,火锅,香洲区梅华西路166号（西藏大厦一楼）,4.6,72,https://www.meituan.com/meishi/1901332630/
串功夫重庆火锅串串香（东坑店）,火锅,香洲区东坑村旅游路一号度假酒店后面（520奶茶隔壁）,0,58,https://www.meituan.com/meishi/175149433/
海里撸串串火锅（新香洲旺角店）,火锅,香洲区敬业路88号（心华路）,4.7,61,https://www.meituan.com/meishi/175480674/
源刘记大串悦小资味串串香（双城汇店）,火锅,香洲区珠海大道3989号105C商铺,4.1,44,https://www.meituan.com/meishi/177446736/
排怀芝士排骨,火锅,金湾区安基东路吉林大学珠海学院永合商业街56号店铺,3.7,75,https://www.meituan.com/meishi/76778198/
新顺昌休闲餐厅,火锅,斗门区斗门大道北280号（财政所对面）,3.5,54,https://www.meituan.com/meishi/90006003/
百素我家酸菜鱼（奥园广场店）,火锅,香洲区旅游路奥园广场购物中心五楼,4.4,56,https://www.meituan.com/meishi/177543371/
福味轩,火锅,香洲区柠溪路374号百合超市旁（妇幼保健院对面，南香里小区正门口）,4.7,88,https://www.meituan.com/meishi/99459313/
爱尚牛鼎记·潮汕牛肉火锅（横琴中央汇店）,火锅,香洲区香江路10号横琴中央汇商业街一楼,4.8,15,https://www.meituan.com/meishi/114032392/
老佛爷炭火蛙锅,火锅,香洲区华平路16-3号,4,95,https://www.meituan.com/meishi/179357864/
品迎记潮汕牛肉火锅,火锅,香洲区大塘新村26号,5,16,https://www.meituan.com/meishi/161120558/
蛙赛碳烤牛蛙,火锅,香洲区华平路61-63号（老磨坊隔壁）,4.3,56,https://www.meituan.com/meishi/162659098/
麻辣风云重庆老火锅（唐家店）,火锅,香洲区唐乐路唐家综合市场2楼,5,61,https://www.meituan.com/meishi/152368392/
海纳·牛肉火锅（夏湾店）,火锅,香洲区夏湾华平路103号（华平路与粤华路交叉口往夏湾市场方向走50米左侧）,4.7,31,https://www.meituan.com/meishi/96219201/
啊咕咔咔牛蛙大咖主题餐厅（金鼎店）,火锅,香洲区金鼎镇上栅大街上栅商业中心22号,3.4,59,https://www.meituan.com/meishi/163438479/
来壹锅羊庄,火锅,香洲区景莲街景山路59号,5,72,https://www.meituan.com/meishi/180075314/
王太爷冒菜,火锅,香洲区前山所前山明珠南路1161号之二（前山华润万家与诚丰广场之间商业街）,3.4,58,https://www.meituan.com/meishi/163449120/
天然居原生态农庄,火锅,香洲区唐家湾镇那谭线金鼎永丰社区石头岗63号（汇客百货南行50米）,3.5,61,https://www.meituan.com/meishi/164207177/
全汁好味驴庄,火锅,香洲区情侣南路358号,4.2,44,https://www.meituan.com/meishi/182383373/
厨先生·水晶焖锅,火锅,金湾区湖心路1138号家和城广场第二层2006-2007号铺位,3.5,54,https://www.meituan.com/meishi/164288529/
三麻九辣美蛙鱼头火锅店,火锅,香洲区环屏路2号广宏苑1楼11号商铺,5,75,https://www.meituan.com/meishi/164318337/
鲜牛牛牛肉店,火锅,香洲区华平路181号夏湾新村西北门对面,4.8,56,https://www.meituan.com/meishi/164567885/
赖胖子肉蟹煲（大信新都汇店）,火锅,斗门区中兴中路328号大信新都汇5F,3.7,15,https://www.meituan.com/meishi/182673180/
温度烤肉专门店,火锅,香洲区华平路原老磨坊,5,88,https://www.meituan.com/meishi/164587976/
愚味老北京涮羊肉,火锅,金湾区斗门区白藤二路3号,3.5,16,https://www.meituan.com/meishi/164704673/
涮嗨了牛肉火锅烤肉,火锅,金湾区金岛路山海一品花园562号商铺,3.4,95,https://www.meituan.com/meishi/183963834/
蓝波斯菊.鲜汤火锅（拱北店）,火锅,香洲区拱北侨光西路169号首层107、108号,4.6,56,https://www.meituan.com/meishi/165338516/
串掌门砂锅串串香（夏湾店）,火锅,香洲区华平路15号（国寿大厦巴士站）,3.8,61,https://www.meituan.com/meishi/168797373/
鱼雅山房,火锅,香洲区华海路68号,4.8,31,https://www.meituan.com/meishi/184600217/
沸騰三国成都火鍋（拱北店）,火锅,香洲区侨光西路169号（棕泉酒店对面）,5,59,https://www.meituan.com/meishi/169184796/
宝岛都捞海鲜火锅（大信新都汇店）,火锅,斗门区中兴中路328号大信新都汇5F（五楼靠近滑冰场观景位）,5,72,https://www.meituan.com/meishi/184601098/
麻辣坊,火锅,斗门区斗门镇大道南120号15铺,4.2,61,https://www.meituan.com/meishi/169501989/
子非鱼,火锅,斗门区江湾一路86号,5,58,https://www.meituan.com/meishi/170595643/
清远鸡煲猪肚鸡纸上烤鱼火焰醉鹅（红旗店）,火锅,金湾区南翔路86-88号（柠檬印象楼下商铺，创宏广场对面）,3.1,44,https://www.meituan.com/meishi/171817101/
鲤景冰室（烤涮一锅）,火锅,香洲区柠溪路271号1号铺,5,54,https://www.meituan.com/meishi/185121258/
撸馆串串锅料理,火锅,香洲区旅游路奥园广场L2-36,4,75,https://www.meituan.com/meishi/177539204/
清远鸡煲猪肚鸡纸上烤鱼火焰醉鹅（井岸店）,火锅,斗门区斗门区江湾中路308号,3.8,56,https://www.meituan.com/meishi/185589120/
串掌门砂锅串串香（金鼎店）,火锅,香洲区金鼎山建一街38号（下栅综合楼底商）,3.9,88,https://www.meituan.com/meishi/177755965/
老方的爱·牛肉饭店,火锅,香洲区柠溪路318号,5,15,https://www.meituan.com/meishi/179498084/
口口香海鲜砂锅粥,火锅,金湾区红旗镇广安路金银花园C座底层9-13轴商铺之11号,4.8,95,https://www.meituan.com/meishi/179760409/
汕头八合里海记牛肉火锅店（华发商都店）,火锅,香洲区珠海大道8号华发商都B馆2层B2028,4.4,16,https://www.meituan.com/meishi/93962847/
潮之牛黄牛肉火锅铺,火锅,香洲区唐淇路305号-5一屋商铺A3号位（福乐购侧门旁）,3.5,56,https://www.meituan.com/meishi/179953890/
牛B牛杂,火锅,斗门区井岸镇西埔村西埔市场商业街好地坊B12铺位,4.3,61,https://www.meituan.com/meishi/93023721/
蓝波斯菊.鲜汤火锅（珠海百货店）,火锅,香洲区景山路222号珠海百货三楼（中庭左上方）,4.7,31,https://www.meituan.com/meishi/185661243/
蜀一数二重庆火锅,火锅,香洲区明珠南路大前门三楼,3.4,59,https://www.meituan.com/meishi/182093924/
凤王府成都火锅（唐家店）,火锅,香洲区唐淇路1208号（唐家市场公交车站旁）,4.5,72,https://www.meituan.com/meishi/186391829/
宜嘉馨灵芝鸡火锅·椰子鸡,火锅,香洲区沿河东路97号A1,5,58,https://www.meituan.com/meishi/182461331/
福记正宗土黄牛牛杂火锅,火锅,香洲区前山梅花路72号（梅花豪庭大门口）,3.5,61,https://www.meituan.com/meishi/183022298/
王品记猪肚鸡,火锅,香洲区景晖路3号,4.7,44,https://www.meituan.com/meishi/184028701/
梧桐樹厨房,火锅,香洲区莲兴路白莲路184号,3,75,https://www.meituan.com/meishi/187857313/
楚公馆功夫牛牛肉火锅,火锅,斗门区斗门区西堤路2157号,4.7,54,https://www.meituan.com/meishi/184512864/
金柜砂锅粥火锅,火锅,香洲区粤华路526号,3,56,https://www.meituan.com/meishi/188470133/
芝麻串串香重庆火锅（唐家店）,火锅,香洲区龙岗街山房路40号（宝岛眼镜后面）,5,15,https://www.meituan.com/meishi/184779895/
日月星潮州火锅餐厅,火锅,香洲区高新区唐家湾镇金鼎下栅金发路58号,4.3,88,https://www.meituan.com/meishi/185440025/
牛庄●潮味鲜牛肉店（银桦店）,火锅,香洲区银桦路237号（农信大厦巴士站后）,5,16,https://www.meituan.com/meishi/97446435/
渝都重庆特色烤鱼,火锅,香洲区双竹街9号,3.5,95,https://www.meituan.com/meishi/185753671/
百蒸坊·旱蒸牛肉主题餐厅,火锅,金湾区广安路25号,4,56,https://www.meituan.com/meishi/188993322/
108酱麻辣火锅,火锅,金湾区金海岸大道西金列圣公寓2栋1层96,5,61,https://www.meituan.com/meishi/186234862/
新友记驴庄,火锅,香洲区广东珠海香洲区前山新乐街5号,3.5,31,https://www.meituan.com/meishi/188021577/
潮天下潮汕牛肉火锅,火锅,香洲区拱北侨光西路337号,3.9,59,https://www.meituan.com/meishi/189663184/
大掌门秘宗火锅,火锅,香洲区昌盛路376号华发世纪城销售中心首层A101铺（M2酒吧旁边）,3.8,72,https://www.meituan.com/meishi/108498505/
福鑫猪肚鸡,火锅,斗门区斗门区272省道中兴中路2号,4.3,58,https://www.meituan.com/meishi/191296486/
虾骨烧（夏湾店）,火锅,香洲区昌平路119-121号,4.5,61,https://www.meituan.com/meishi/192234355/
虾骨烧（夏湾店）,火锅,香洲区昌平路119-121号,4.5,44,https://www.meituan.com/meishi/192234355/
星语卜卜贝,火锅,香洲区桂花北路155号嗨森里文化广场,3.5,54,https://www.meituan.com/meishi/192663612/
竹签串串香,火锅,香洲区华平路59号铺,5,75,https://www.meituan.com/meishi/192916178/
签王之王牛肉串串火锅（北山里店）,火锅,香洲区北山路,4,56,https://www.meituan.com/meishi/193272579/
蜀八婆香汁焖锅,火锅,横琴新区横琴区宝中路108号,3.5,15,https://www.meituan.com/meishi/193448784/
壹品柠檬鱼（天虹商场店）,火锅,香洲区明珠南路1101号天虹商场5楼P509号,4.7,88,https://www.meituan.com/meishi/118993910/
澳门鲜味王（拱北店）,火锅,香洲区侨光路169号（近宝裕美食街）,3.7,95,https://www.meituan.com/meishi/192740498/
鱼你相约·火山喷泉锅,火锅,香洲区明珠南路1953号二城商业广场4楼,4.5,16,https://www.meituan.com/meishi/193651710/
