餐厅名,种类,地址,评分,人均,链接
渝都重庆特色烤鱼,香锅烤鱼,香洲区双竹街9号,3.5,61,https://www.meituan.com/meishi/185753671/
七哥美食,香锅烤鱼,斗门区桥湖北路265号（中国农业银行北行50米）,3.5,31,https://www.meituan.com/meishi/177994016/
鱼蛙大咖,香锅烤鱼,香洲区柠溪路212号一楼A2商铺,5,59,https://www.meituan.com/meishi/829228561/
鱼见柠檬鱼,香锅烤鱼,香洲区北山正街2号北山牌坊,3.5,72,https://www.meituan.com/meishi/171881404/
重庆石锅鱼,香锅烤鱼,斗门区白蕉路3166号日富大厦一楼,4,58,https://www.meituan.com/meishi/157145635/
蛙大叔·炭火蛙锅纸包鱼（二城广场店）,香锅烤鱼,香洲区明珠南路2051号二城广场4楼,5,61,https://www.meituan.com/meishi/734476666/
重庆石锅鱼烤活鱼,香锅烤鱼,香洲区翠前北路翠峰街211号商铺,4.9,44,https://www.meituan.com/meishi/76134337/
悠香汇麻辣香锅,香锅烤鱼,香洲区领秀城步行街134号,4.1,75,https://www.meituan.com/meishi/2485426/
好吃懒做共享餐厅（扬名广场店）,香锅烤鱼,香洲区先烈巷凤凰南路1130号（兄昌饭店旁）,3.3,54,https://www.meituan.com/meishi/192254089/
不夜天柴火烤鱼（网购店）,香锅烤鱼,金湾区文华路与藤荣路交叉口旁,3,56,https://www.meituan.com/meishi/41575257/
桃园里蛙音乐烤吧,香锅烤鱼,金湾区虹晖路旭泰商业城南门一楼,4.7,88,https://www.meituan.com/meishi/173363258/
多伦多麻辣香锅,香锅烤鱼,金湾区广安路欧邦花园（法院附近）,4.1,15,https://www.meituan.com/meishi/41629250/
湛雷华记美食店,香锅烤鱼,香洲区唐家湾镇港湾大道鸡山村中山大学南门（食神左侧）,3.7,16,https://www.meituan.com/meishi/97414711/
海记石锅鱼,香锅烤鱼,香洲区拱北水湾路157号（金百合对面）,3.8,95,https://www.meituan.com/meishi/42528001/
重庆石锅鱼（兰埔店）,香锅烤鱼,香洲区兰埔路125号（兰埔郵政银行正对面）,4,56,https://www.meituan.com/meishi/4624532/
壹烤鱼,香锅烤鱼,斗门区斗门区港霞东路135号,4.1,61,https://www.meituan.com/meishi/189829036/
渔乐纸包鱼,香锅烤鱼,香洲区圣皇头街下栅综合楼商铺,4.5,31,https://www.meituan.com/meishi/1197934951/
聚兴餐厅,香锅烤鱼,香洲区夏美路183号-2,4.5,59,https://www.meituan.com/meishi/160003528/
同桌的蛙（三灶店）,香锅烤鱼,金湾区金湾区机场西路,3.2,72,https://www.meituan.com/meishi/186066051/
德和坊,香锅烤鱼,香洲区明园路24号,3.7,61,https://www.meituan.com/meishi/186111039/
追鱼记主题餐厅,香锅烤鱼,金湾区珠海大道西,3,58,https://www.meituan.com/meishi/186990720/
陆柒零烤鱼,香锅烤鱼,香洲区东门街前山新城124号,3.7,44,https://www.meituan.com/meishi/189414442/
木马烤鱼,香锅烤鱼,香洲区前湾一路高新新天地3栋1层,3.1,75,https://www.meituan.com/meishi/186883853/
侦碳社餐厅,香锅烤鱼,香洲区柠溪路213号（柠溪邮局对面，上岛咖啡楼下）,4.1,54,https://www.meituan.com/meishi/162058674/
万州烤鱼,香锅烤鱼,香洲区香洲财源道步行街503号,3.8,56,https://www.meituan.com/meishi/42047185/
柳叶湖石锅鱼万州烤鱼（金湾店）,香锅烤鱼,金湾区红旗镇南翔路柠檬印象90-92号（农商银行旁）,4.4,15,https://www.meituan.com/meishi/4734291/
家的味道烤鱼酸菜鱼,香锅烤鱼,香洲区夏美路189-1号,4.3,88,https://www.meituan.com/meishi/4987669/
千百味餐厅,香锅烤鱼,香洲区前山3台石路前山市场后侧,4.4,16,https://www.meituan.com/meishi/41074938/
味禾猪肚鸡石锅鱼,香锅烤鱼,香洲区唐家综合市场49-50卡,4.5,95,https://www.meituan.com/meishi/42064528/
红雨轩香辣蟹（兰埔店）,香锅烤鱼,香洲区桂花北路237号（兰埔加油站对面）,4,56,https://www.meituan.com/meishi/52888886/
子非鱼,香锅烤鱼,斗门区江湾一路86号,5,61,https://www.meituan.com/meishi/170595643/
麻辣坊,香锅烤鱼,斗门区斗门镇大道南120号15铺,4.2,31,https://www.meituan.com/meishi/169501989/
钟鱼来了鱼火锅（官塘店）,香锅烤鱼,香洲区唐家湾镇金唐西路官塘陶园新村12号（北理北门对面，百世汇通快递旁）,4.2,59,https://www.meituan.com/meishi/42790928/
柳艳锋麻辣香锅,香锅烤鱼,香洲区粤华路敏捷商业中心1楼鲜一街旁,3.7,72,https://www.meituan.com/meishi/171606068/
重庆烤活鱼石锅鱼,香锅烤鱼,香洲区华平路31号,4,58,https://www.meituan.com/meishi/40139710/
重庆乌江鱼,香锅烤鱼,香洲区弘桥商场1楼5号铺,3.9,61,https://www.meituan.com/meishi/163513373/
重庆纸上烤鱼,香锅烤鱼,香洲区南湾北路南屏商业中心1楼,3.8,44,https://www.meituan.com/meishi/40281967/
老湘菜馆（南屏店）,香锅烤鱼,香洲区南屏镇环屏路5号商业楼M011商铺,4.6,54,https://www.meituan.com/meishi/4069068/
渝州烤鱼,香锅烤鱼,斗门区斗门区白蕉镇珠海市斗门区白蕉镇城东金坑中苑第8栋47、48号,5,75,https://www.meituan.com/meishi/194476944/
聚佳餐厅（拱北店）,香锅烤鱼,香洲区拱北粤华路新市花园侧（大家乐背后）,4.3,56,https://www.meituan.com/meishi/2214382/
万州烤鱼（昌平路店）,香锅烤鱼,香洲区夏湾昌平路61号（华苑花园大门旁边）,4.4,88,https://www.meituan.com/meishi/6271796/
鱼魔王  新派.烤鱼（红旗店）,香锅烤鱼,金湾区红旗镇创宏商业广场一楼,3.6,15,https://www.meituan.com/meishi/165519553/
辣食尚麻辣香锅店,香锅烤鱼,金湾区三灶镇草堂湾百川路1号商业广场翰林公寓108号商铺,4.7,95,https://www.meituan.com/meishi/5003454/
上瘾麻辣香锅,香锅烤鱼,香洲区唐家湾镇唐淇路3399号2栋116号（唐人商业中心街）,5,16,https://www.meituan.com/meishi/153734621/
蜀八婆香汁焖锅,香锅烤鱼,横琴新区横琴区宝中路108号,3.5,56,https://www.meituan.com/meishi/193448784/
蚝食,香锅烤鱼,香洲区紫荆路290号紫荆大厦底商,3.8,61,https://www.meituan.com/meishi/194274274/
悠客鱼悦,香锅烤鱼,香洲区龙舟路龙舟街58号,4,31,https://www.meituan.com/meishi/194954104/
啊兴碳烤活鱼,香锅烤鱼,香洲区华平路16-3号都市花b区大门美宜佳隔壁,5,59,https://www.meituan.com/meishi/195276536/
钩搭纸包鱼（西埔店）,香锅烤鱼,斗门区西埔路中业商业楼首层110铺,3.5,72,https://www.meituan.com/meishi/801375646/
渝湘汇,香锅烤鱼,香洲区粤海东路1123号,3.5,58,https://www.meituan.com/meishi/936728899/
冯姐生蚝大排档（南屏店）,香锅烤鱼,香洲区南屏镇珠海大道东大粤容闳广场,4.5,61,https://www.meituan.com/meishi/90774532/
尚鑫台湾胡椒虾,香锅烤鱼,香洲区昌平路251号,3.5,44,https://www.meituan.com/meishi/1014342881/
黄太爷麻辣香锅,香锅烤鱼,香洲区珠海前山明珠南路1161号（明珠商业广场华润万家旁面相华润万家往左手走两百米）,4,54,https://www.meituan.com/meishi/131695128/
牛蛙爱上鱼（井岸店）,香锅烤鱼,斗门区中兴南路248号顺客隆一楼119号商铺（建设银行旁边）,3.8,75,https://www.meituan.com/meishi/116124208/
百乐饭店,香锅烤鱼,香洲区银桦路49号（888街巴士站对面）,4.1,56,https://www.meituan.com/meishi/159061031/
鱼味烤鱼,香锅烤鱼,金湾区金瀚路西湖市场一楼E02号铺位,5,88,https://www.meituan.com/meishi/169020537/
情义巴蜀火锅城,香锅烤鱼,香洲区金鼎金峰中路15号（近金鼎市场）,3.7,15,https://www.meituan.com/meishi/171876882/
禄小宝酸菜鱼（横琴中央汇店）,香锅烤鱼,香洲区香江路10号二楼209号商铺（中央汇湘之味对面）,3.7,95,https://www.meituan.com/meishi/179327765/
赖胖子肉蟹煲（大信新都汇店）,香锅烤鱼,斗门区中兴中路328号大信新都汇5F,3.7,16,https://www.meituan.com/meishi/182673180/
锅掌门小郡肝串串,香锅烤鱼,斗门区埔青街与金泰路交叉口东50米,4.5,56,https://www.meituan.com/meishi/184203912/
鱼魂食尚双椒鱼餐厅,香锅烤鱼,香洲区明珠南路大前门3楼-09-10号铺,4.5,61,https://www.meituan.com/meishi/185652442/
利章美蛙鱼头火锅,香锅烤鱼,香洲区明珠南路1026号,5,31,https://www.meituan.com/meishi/187861033/
愿者上钩,香锅烤鱼,香洲区环屏路24号,4.7,59,https://www.meituan.com/meishi/190633773/
巴蜀鱼府（北岭店）,香锅烤鱼,香洲区珠海市香洲区拱北桥岭街7号之一,3.7,72,https://www.meituan.com/meishi/193904094/
夜小馆,香锅烤鱼,斗门区白蕉镇永福二路与白蕉路交口向西100米,3.9,58,https://www.meituan.com/meishi/94063847/
红雨轩香辣蟹（园林路店）,香锅烤鱼,香洲区吉大园林路平安大厦右侧底商45-110号,4.5,61,https://www.meituan.com/meishi/98385257/
谷物基,香锅烤鱼,香洲区前山金鸡西路608号,3,44,https://www.meituan.com/meishi/195144552/
大年初一·铁锅炖,香锅烤鱼,斗门区连桥路248号,4.1,75,https://www.meituan.com/meishi/170616887/
蛙大虾,香锅烤鱼,斗门区桥湖南路41号,4.9,54,https://www.meituan.com/meishi/174863328/
探鱼（奥园广场店）,香锅烤鱼,香洲区旅游路珠海奥园广场4楼12号,3.4,56,https://www.meituan.com/meishi/177604622/
张大师鸭爪爪特色火锅,香锅烤鱼,香洲区明珠南路金嘉创业谷1栋（翠景工业区巴士站后）,4.9,88,https://www.meituan.com/meishi/113125866/
人来人往烧烤吧,香锅烤鱼,香洲区香洲柠溪路双竹街20号1栋9号（岭南世家正门往柠溪路直走50米右转50米，在道路左侧）,4,15,https://www.meituan.com/meishi/105778200/
晓飞烤鱼,香锅烤鱼,香洲区新加坡花园1期（阳光幼儿园楼下）,5,95,https://www.meituan.com/meishi/110909469/
食肉兽,香锅烤鱼,斗门区滨江路78-80号,5,16,https://www.meituan.com/meishi/150446912/
探花礼音乐餐吧,香锅烤鱼,香洲区柠溪路99号（鸿泰溪城处）,3.5,56,https://www.meituan.com/meishi/194413328/
海米猪肚鸡,香锅烤鱼,香洲区屏东六路泰东街78号,4,61,https://www.meituan.com/meishi/194662286/
一品龙虾,香锅烤鱼,香洲区前山街道明珠南路北辰花园西门口,3.4,31,https://www.meituan.com/meishi/95685962/
流星雨烤鱼,香锅烤鱼,香洲区唐家镇山房路221号白马烤鱼对面。,5,59,https://www.meituan.com/meishi/157676130/
王太爷牛蛙恋湘鱼（前山直营店）,香锅烤鱼,香洲区珠海香洲区前山明珠南路1159号（诚丰广场与华润万家之间）,4.2,72,https://www.meituan.com/meishi/1667795989/
啊咕咔咔牛蛙大咖主题餐厅（金鼎店）,香锅烤鱼,香洲区金鼎镇上栅大街上栅商业中心22号,3.4,61,https://www.meituan.com/meishi/163438479/
柠檬鱼（朝阳路店）,香锅烤鱼,香洲区朝阳路103号金裕时尚酒店隔壁（牛津公馆对面）,3,58,https://www.meituan.com/meishi/169365154/
探鱼（扬名广场店）,香锅烤鱼,香洲区凤凰南路1066号扬名广场2期L7,3.4,44,https://www.meituan.com/meishi/40464342/
寻味烧烤,香锅烤鱼,香洲区南屏街口，华夏国际酒店旁，容闳广场1楼,4.6,75,https://www.meituan.com/meishi/91510902/
金众记猪肚鸡（唐家店）,香锅烤鱼,香洲区唐家湾镇岭头脚二巷36号一楼商铺,5,54,https://www.meituan.com/meishi/163423044/
渔小二·渔家乐餐厅,香锅烤鱼,香洲区龙舟街58号（海景酒店旁）,4.9,56,https://www.meituan.com/meishi/132809895/
棕泉酒店东方御宴,粤菜,香洲区夏湾侨光西路220号,3.7,44,https://www.meituan.com/meishi/2526938/
海鸿鲜蒸煮题餐厅（夏湾店）,粤菜,香洲区昌平路春泽名园288、290、292号铺（老川坊对面）,5,54,https://www.meituan.com/meishi/50659794/
万悦酒店·金厨泰国餐厅,粤菜,香洲区水湾路28号万悦酒店4楼,5,75,https://www.meituan.com/meishi/40654155/
福森小镇（日月贝店）,粤菜,香洲区渔湾路29号（海韵城A区一层L1-5-7）,3.6,56,https://www.meituan.com/meishi/164384775/
和轩（香洲店）,粤菜,香洲区人民东路313号恒和中心1栋3楼,5,88,https://www.meituan.com/meishi/5296415/
如轩砂锅粥（迎宾南路店）,粤菜,香洲区迎宾南路2126号香江大厦一层101-3铺（香江维克酒店旁）,5,15,https://www.meituan.com/meishi/49094/
樂记冰室（奥园广场店）,粤菜,香洲区梅界路奥园广场SY6-19-21铺（篮球场对面）,5,95,https://www.meituan.com/meishi/195597591/
茶米香中餐厅（海泉湾店）,粤菜,金湾区海泉湾大酒店海王星大酒店1楼,5,16,https://www.meituan.com/meishi/1236168/
龙发海鲜城,粤菜,香洲区吉大景乐路平安大厦旁,4.9,56,https://www.meituan.com/meishi/1536375/
MACAU金捞茶餐厅,粤菜,香洲区柠溪路309号,4.8,61,https://www.meituan.com/meishi/195099442/
Refill悦府,粤菜,香洲区九洲大道西2023号富华里中心之9-103、201号商铺,5,31,https://www.meituan.com/meishi/42966541/
尚品轩,粤菜,香洲区夏湾路171-175号（近港昌路）,4.5,59,https://www.meituan.com/meishi/2755972/
金莎茶餐厅,粤菜,香洲区拱北港昌路136号,3.5,72,https://www.meituan.com/meishi/1165752099/
嘉远世纪酒店·似水流年西餐,粤菜,香洲区拱北兰埔路216号（近香洲人民医院）,4.9,61,https://www.meituan.com/meishi/2427423/
印记·粤膳坊百姓厨房,粤菜,香洲区翠微西路668号,4.3,58,https://www.meituan.com/meishi/51572688/
焌杰冰室,粤菜,香洲区香洲凤凰北路1038号（凤凰微校）,3.5,44,https://www.meituan.com/meishi/165888675/
食神海鲜城（拱北店）,粤菜,香洲区高沙中街108号南洋海景酒店1楼(近拱北汽车站),4.3,54,https://www.meituan.com/meishi/1235917/
嘉远世纪酒店·品极轩海鲜酒楼,粤菜,香洲区兰埔路216号（嘉远世纪酒店）,4.5,75,https://www.meituan.com/meishi/2437949/
湛王海鲜酒楼,粤菜,香洲区湾仔海鲜街13号（近湾仔旅游码头）,5,56,https://www.meituan.com/meishi/1239275/
香港富临皇宫（扬名广场店）,粤菜,香洲区凤凰南路1066号（扬名广场二期八楼）,3.8,88,https://www.meituan.com/meishi/40720925/
月季轩,粤菜,香洲区情侣南路305号景湾阁2层,4.1,15,https://www.meituan.com/meishi/1237412/
德兴show鲜·蒸汽海鲜火锅餐厅（体育中心店）,粤菜,香洲区红山路163号体育中心南门,4.5,95,https://www.meituan.com/meishi/41722728/
五号院ClubNo.5,粤菜,香洲区水湾路333号轩坤花苑5栋别墅(南油大酒店),4.7,16,https://www.meituan.com/meishi/1238896/
喜多多茶餐厅（湾仔店）,粤菜,香洲区湾仔上沙路24号水岸华都商业街内,5,56,https://www.meituan.com/meishi/41550731/
心语茶室（华海路店）,粤菜,香洲区凤凰北华海路156号（晶都花园门市）,5,61,https://www.meituan.com/meishi/5686626/
海湾壹品,粤菜,香洲区拱北水湾路245号海湾大酒店2楼,4.5,31,https://www.meituan.com/meishi/1524413/
顺德公一品粥,粤菜,香洲区情侣南路483号（九州花园处）,4.1,59,https://www.meituan.com/meishi/1237438/
昌记潮汕牛肉火锅店,粤菜,香洲区乐园东路号海悦居14-18号铺（近鼎记猪肚鸡）,5,72,https://www.meituan.com/meishi/2214970/
万悦酒店·中餐厅,粤菜,香洲区拱北水湾路28号万悦酒店22楼,4.4,61,https://www.meituan.com/meishi/40111100/
新成海鲜酒家,粤菜,香洲区园林路69号（中国农业银行旁）,4.1,58,https://www.meituan.com/meishi/1237739/
少爷十八（富华里店）,粤菜,香洲区九洲大道西2033号中海富华里6栋1-08,3.7,44,https://www.meituan.com/meishi/41251589/
表妹香港靓点餐厅,粤菜,香洲区凤凰南路1066号（扬名广场二期负一层）,3.5,54,https://www.meituan.com/meishi/41220432/
金山林酒店·幸福园中餐厅（中餐厅）,粤菜,金湾区机场大道西路366号C幢,3.9,75,https://www.meituan.com/meishi/40700801/
翠景湾脆鱼轩,粤菜,斗门区井岸镇尖峰前路2号7幢309铺,5,56,https://www.meituan.com/meishi/6499156/
有鸡厨房（夏湾创始店）,粤菜,香洲区夏湾粤华路329号（农业银行对面）,3.9,15,https://www.meituan.com/meishi/1238072/
卓卓有渔顺德私房菜,粤菜,香洲区柠溪所柠溪路489号2楼（重庆山城二楼）,4.1,88,https://www.meituan.com/meishi/42252074/
福怡轩海鲜火锅酒楼,粤菜,金湾区金荷路555号（贤德教育西30米）,3.7,16,https://www.meituan.com/meishi/41598138/
顺业名湖海鲜酒楼,粤菜,斗门区白藤湖酒吧城内C座（近鳄鱼岛）,3.7,95,https://www.meituan.com/meishi/1238499/
龙宝轩海鲜火锅酒家,粤菜,香洲区迎宾北路南村豪苑东门底商,3.9,56,https://www.meituan.com/meishi/1240564/
食神海鲜城（唐家店）,粤菜,香洲区唐淇路437号鸡山综合楼（近港湾大道）,4,61,https://www.meituan.com/meishi/1236027/
四季佳景酒家,粤菜,香洲区珠海大道8号华发商都C馆4-5层C4001-C5001号铺,3.5,31,https://www.meituan.com/meishi/4095939/
大厨小盏,粤菜,香洲区上华路1号（中珠上城会所一楼）,3.9,59,https://www.meituan.com/meishi/41048140/
粤海璇宫,粤菜,香洲区粤海东路1145号粤海酒店29楼,4.1,72,https://www.meituan.com/meishi/1239480/
悦和庄餐厅,粤菜,香洲区迎宾北路2042号（即拱北往遂道去香洲方向，迎宾北路交人民路口向前50米，南村东巴士站旁）,3.6,61,https://www.meituan.com/meishi/2441923/
红叶美食广场,粤菜,金湾区榕月路158号（三阳商业广场处）,4.2,58,https://www.meituan.com/meishi/64726697/
嘻语小馆,粤菜,香洲区金鼎金峰中路73号商铺,4.2,44,https://www.meituan.com/meishi/4047994/
龙禧渔村酒楼,粤菜,香洲区银桦路48号c栋,4,54,https://www.meituan.com/meishi/52279050/
喜点茶餐厅（华发商都店）,粤菜,香洲区珠海大道8号（华发商都B馆二楼，汕头八合里海记牛肉火锅旁）,3.9,75,https://www.meituan.com/meishi/40238799/
时步餐厅,粤菜,香洲区明圆路（近中山大学北门）,3.5,56,https://www.meituan.com/meishi/1238129/
上岛咖啡（旺角百货店）,粤菜,香洲区敬业路88号旺角百货2楼,4.2,15,https://www.meituan.com/meishi/76550/
海龙宫饭店,粤菜,金湾区272省道587乡道珠海机场旁,3.4,88,https://www.meituan.com/meishi/2782308/
隆都四季香饭店,粤菜,香洲区碧海路18号（香洲医院湾仔沙门诊部直入10米）,3.9,95,https://www.meituan.com/meishi/1237375/
好知己农庄,粤菜,香洲区湾仔街道连屏社区100号（横琴高速路口旁）,3,16,https://www.meituan.com/meishi/1238721/
渔米之乡酒楼,粤菜,香洲区粤海中路2610号（银石雅园南十六小学旁）,4.1,56,https://www.meituan.com/meishi/1237992/
银都茶皇殿,粤菜,香洲区粤海东路1150号，银都酒店1楼，前厅接待处左转,4.4,61,https://www.meituan.com/meishi/1236975/
平沙南记砂锅粥大排档（西埔店）,粤菜,斗门区井岸镇西埔路16-19号,4,31,https://www.meituan.com/meishi/42769085/
汤王私房菜,粤菜,香洲区石花东路169号海湾花园30栋105-109号,4.1,59,https://www.meituan.com/meishi/1238272/
杨记海鲜餐厅,粤菜,香洲区明珠北路24号-2栋-1层,4.2,72,https://www.meituan.com/meishi/2214540/
祥祺酒店豪宴酒楼,粤菜,金湾区金湾路1号祥祺酒店三楼,3.9,58,https://www.meituan.com/meishi/6201327/
味之林（沿河路店）,粤菜,香洲区沿河东路215号（为农市场巴士站旁）,4.1,61,https://www.meituan.com/meishi/1237478/
富苑茶餐厅（康宁路店）,粤菜,香洲区康宁路68号裕景商务酒店1楼,3.5,44,https://www.meituan.com/meishi/2213343/
森哥美食海鲜火锅（侨光路店）,粤菜,香洲区侨光西路245号,3.9,54,https://www.meituan.com/meishi/41523358/
大宅门食府,粤菜,香洲区前山上冲梅溪村梅溪牌坊侧,3.3,75,https://www.meituan.com/meishi/1236155/
中邦艺术酒店中餐厅·沪粤轩,粤菜,香洲区情侣中路33号中邦艺术酒店一楼（近吉大海滨泳场）,4.7,56,https://www.meituan.com/meishi/1237832/
贺富酒家（白藤二路分店）,粤菜,金湾区湖心路白藤头白藤二路（同步齿科珠海斗门同美口腔门诊部，车立方汽车美容）,3.7,15,https://www.meituan.com/meishi/1238340/
大鱼湾农庄,粤菜,香洲区屏北二路1号,4.1,88,https://www.meituan.com/meishi/6770387/
阿山烤鸡美食广场,粤菜,香洲区关闸西街37号（近昌安酒店停车场）,3.7,16,https://www.meituan.com/meishi/2782347/
乡村小园,粤菜,斗门区珠峰大道东风广场旁（原添成庄园）,3.7,95,https://www.meituan.com/meishi/5878905/
客语-客家菜（扬名广场店）,粤菜,香洲区凤凰南路扬名广场1066号第六层L6007商铺,3.3,56,https://www.meituan.com/meishi/41536617/
常胜鲍鱼（吉大店）,粤菜,香洲区石花东路海湾花园30栋105-109号,4.3,61,https://www.meituan.com/meishi/1235951/
客语-客家菜（华发商都店）,粤菜,香洲区珠海市珠海大道8号1#楼2层A2058号商铺,3.4,31,https://www.meituan.com/meishi/41437479/
永新顺隆美食店,粤菜,香洲区海洲路31号（海泳酒店）,3.9,59,https://www.meituan.com/meishi/5273151/
潮汕肥仔食店,粤菜,香洲区白莲路163号铺,3.5,72,https://www.meituan.com/meishi/1240335/
海边优广美食店,粤菜,香洲区大姑乸街与景和街交叉口东北50米,3,61,https://www.meituan.com/meishi/50882949/
得月舫,粤菜,香洲区情侣中路野狸岛名亭公园内,4,58,https://www.meituan.com/meishi/1235748/
老五小食馆,粤菜,香洲区兴华路64号（紫荆园巴士站旁，紫荆路和兴华路交界处）,3.7,44,https://www.meituan.com/meishi/1238429/
叠泉山庄,粤菜,香洲区南湾北路人民法院执行局西约200米路南,4.3,75,https://www.meituan.com/meishi/2516140/
海之湾海鲜美食,粤菜,香洲区情侣中路63号（珠海渔女停车场内）,3.5,54,https://www.meituan.com/meishi/6493114/
BLING粥栈,粤菜,香洲区唐家湾淇澳所明园路七巷11号102号铺,3.8,56,https://www.meituan.com/meishi/51444582/
尚品捞火锅茶餐厅,粤菜,香洲区湾仔中盛路42号（建设银行对面）,3.9,88,https://www.meituan.com/meishi/41409474/
红树轩餐饮,粤菜,香洲区前河西路333号中信红树湾9栋1楼,3.8,15,https://www.meituan.com/meishi/42360470/
手指公海鲜美食,粤菜,香洲区情侣中路53号,3.7,95,https://www.meituan.com/meishi/1237617/
仙庙烧鸡（南屏店）,粤菜,"香洲区南屏镇屏东六路76号（蓝山酒店一楼,南屏派出所斜对面）",4.1,16,https://www.meituan.com/meishi/64155203/
逸丽澳门茶餐厅,粤菜,香洲区兰埔路41号,3.9,56,https://www.meituan.com/meishi/42583699/
德翰大酒店凯旋宫中餐厅,粤菜,香洲区吉大路2号德翰大酒店3楼,4.1,61,https://www.meituan.com/meishi/6772411/
翠微茶楼饭店,粤菜,香洲区明珠南路3062号（月主题酒店后面）,3.3,31,https://www.meituan.com/meishi/4543204/
海南羊庄私房菜（上冲店）,粤菜,香洲区上冲村新西街38号4栋1层2号（近上冲工业区）,5,59,https://www.meituan.com/meishi/41842378/
玥记茶餐厅（前山店）,粤菜,香洲区前山路37号翰林院19号商铺,3.7,72,https://www.meituan.com/meishi/60660710/
风雅老树咖啡（前山店）,粤菜,香洲区前山前山明珠南路1389号（明珠商业广场）,3.3,58,https://www.meituan.com/meishi/1239857/
翠源茶楼,粤菜,香洲区翠微西路668号,3.5,61,https://www.meituan.com/meishi/40640390/
威记农庄,粤菜,香洲区268省道金州路85号（金鼎中学旁）,5,44,https://www.meituan.com/meishi/63861863/
味缘·磨磨香（富华里店）,粤菜,香洲区九洲大道西2033号中海富华里2栋2-02,4.4,54,https://www.meituan.com/meishi/64843470/
果度大排档（横琴长隆店）,粤菜,横琴新区宝兴路45-47号（长隆附近有车接）,3.6,75,https://www.meituan.com/meishi/40994489/
潮记醉鹅,粤菜,香洲区夏湾西街32号B铺（春泽名园后门）,4.4,56,https://www.meituan.com/meishi/42470446/
澳门琛情咖喱茶餐厅（夏湾店）,粤菜,香洲区夏湾粤华路499号商铺（嘉豪园巴士站往夏湾批发市场走100米左侧）,5,88,https://www.meituan.com/meishi/2214180/
长润牛羊坊（新香洲店）,粤菜,香洲区香华路401号（新加坡花园2-3期门口）（十九小学旁）,3.9,15,https://www.meituan.com/meishi/1239535/
老妈炒鸡（吉柠路店）,粤菜,香洲区柠溪路158号柠溪邮局后侧（近加油站）,4.2,95,https://www.meituan.com/meishi/1237684/
五月花海鲜大酒楼,粤菜,香洲区情侣中路49号日东广场3楼,5,16,https://www.meituan.com/meishi/2576045/
兴隆茶餐厅,粤菜,横琴新区长隆海洋王国内马戏酒店酒吧街便利店旁,3.7,56,https://www.meituan.com/meishi/52543883/
小精灵茶餐厅,粤菜,香洲区碧涛路23号（漫天香手抓小龙虾旁）,5,61,https://www.meituan.com/meishi/4052079/
粤海湾海鲜楼,粤菜,香洲区湾仔海鲜街88号（湾仔旅游码头）,3.5,31,https://www.meituan.com/meishi/2214777/
柳叶湖石锅鱼万州烤鱼（金湾店）,粤菜,金湾区红旗镇南翔路柠檬印象90-92号（农商银行旁）,4.4,59,https://www.meituan.com/meishi/4734291/
潮汕餐厅,粤菜,香洲区岱山路麒麟花园路口（城丰广场）,3.8,72,https://www.meituan.com/meishi/50514845/
甜之心（香洲丹田店）,粤菜,香洲区凤凰北路1005号甜之心,5,58,https://www.meituan.com/meishi/5899543/
品点蒸艺餐厅,粤菜,香洲区翠海路124号（扬名广场后面）,3.7,61,https://www.meituan.com/meishi/42694229/
潮味坊（紫荆店）,粤菜,香洲区紫荆路303号（中珠水晶堡112号水晶堡商业广场魅族专卖店隔壁）,3.9,44,https://www.meituan.com/meishi/4930999/
老字号歪记驰名澳门骨煲,粤菜,香洲区粤华路与关闸中街中街交叉口昌隆五金交电正对面（近莲花路昌安酒店停车场）,3.5,54,https://www.meituan.com/meishi/2805048/
