餐厅名,种类,地址,评分,人均,链接
KOOKOO亲子餐厅,西餐,香洲区南屏中信红树湾南区-01号门,3.3,72,https://www.meituan.com/meishi/193209777/
蔬蕾沙拉（吉大店）,西餐,香洲区吉大园林路128号金嘉广场一楼,5,58,https://www.meituan.com/meishi/158922019/
一把青·人文茶餐厅,西餐,香洲区山场路110号,4.9,61,https://www.meituan.com/meishi/194434470/
绿茵阁西餐厅（体育中心店）,西餐,香洲区红山路163号U派酒店旁,4.1,44,https://www.meituan.com/meishi/194530129/
PROJECT D,西餐,香洲区柠溪路284号柠溪文化广场4楼412-413,3.5,54,https://www.meituan.com/meishi/194564438/
丸子姐姐·披萨（东咀店）,西餐,金湾区虹阳路183号7栋104商铺（海南羊庄后面）,4.4,75,https://www.meituan.com/meishi/159659978/
日当午创意轻食,西餐,香洲区狮山街道南夏丰泽园商业步行街96号铺,4,56,https://www.meituan.com/meishi/195924666/
Casa pepe,西餐,香洲区水湾路215-217号（酒吧街水湾一号隔壁）,4.6,88,https://www.meituan.com/meishi/162114991/
赛百味（横琴中央汇店）,西餐,香洲区香江路10号横琴中央汇商业街一楼,3.4,15,https://www.meituan.com/meishi/114929366/
Ease Cafe&Canteen,西餐,香洲区丰华路华发新城五期198栋（别墅区）,3.5,95,https://www.meituan.com/meishi/1446998257/
留恋披萨,西餐,香洲区岭南路68号1002商铺（摩尔广场益健观光电梯旁边）,4.2,16,https://www.meituan.com/meishi/84173671/
富隆酒窖,西餐,香洲区情侣南路288号-113号铺,4.4,56,https://www.meituan.com/meishi/110419706/
Sanpo,西餐,斗门区井岸镇南潮新村二巷1号1号铺位,3.5,61,https://www.meituan.com/meishi/160716952/
碧湾牛扒餐厅,西餐,香洲区拱北昌盛路74号7栋4单元108,3.6,31,https://www.meituan.com/meishi/164449461/
蓝天海岸西餐厅（柠溪店）,西餐,香洲区柠溪路261号（柠溪邮局斜对面）,3.8,59,https://www.meituan.com/meishi/165210628/
市外茶餐厅（美丽湾店）,西餐,香洲区港湾大道情侣北路199号（品海轩旁）,3.5,72,https://www.meituan.com/meishi/165384088/
简遇西餐厅,西餐,香洲区翠前北路244号晴朗新地园1楼（健华医院旁，翠微市场斜对面）,4,58,https://www.meituan.com/meishi/168886199/
蛋壳披萨（井岸店）,西餐,斗门区江湾中路98号（赵家园金牛酒楼旁边）,4.1,61,https://www.meituan.com/meishi/157805143/
简寻味·无国界创意西餐（珠海奥园店）,西餐,香洲区旅游路奥园广场L5-09,3.4,44,https://www.meituan.com/meishi/177544370/
山麦 SANMAT（南海大厦店）,西餐,斗门区港霞东路与环山北路3号南海大厦首层,4,54,https://www.meituan.com/meishi/180656978/
乐享缤纷,西餐,金湾区平沙镇美平东路285号之四、五铺（长春药店旁）,3.5,75,https://www.meituan.com/meishi/157067111/
珠海瑞吉酒店·LaBrezza意大利餐厅,西餐,香洲区银湾路1663号珠海瑞吉酒店71层,3.8,56,https://www.meituan.com/meishi/182554674/
德亿堡（北理工分店）,西餐,香洲区唐家湾镇金鼎金峰西路9号6栋（1号餐厅）,3.8,88,https://www.meituan.com/meishi/93719039/
仁恒洲际酒店·恰餐厅与酒吧,西餐,香洲区情侣南路珠海仁恒洲际酒店5楼,4.1,15,https://www.meituan.com/meishi/184992031/
乐尊比萨,西餐,斗门区白蕉镇虹桥三路商业7区08号铺,4.3,95,https://www.meituan.com/meishi/185890750/
Fit Salad 轻食沙拉,西餐,香洲区翠微西路诚丰水晶座楼下402-2商铺（色色婚纱店旁）,5,16,https://www.meituan.com/meishi/186403098/
仕佳西餐厅,西餐,香洲区湾仔国际会展中心华发会展公寓一楼,4.4,56,https://www.meituan.com/meishi/90498800/
ZaoBar精酿餐吧,西餐,香洲区粤华路433号金莎公馆,5,61,https://www.meituan.com/meishi/191294144/
粤海璇宫SKY29音乐餐吧,西餐,香洲区粤海东路1145号粤海酒店29楼,3,31,https://www.meituan.com/meishi/193681850/
西西里披萨,西餐,香洲区金凤路宁堂村38号,0,59,https://www.meituan.com/meishi/118204951/
肯迪乐汉堡,西餐,香洲区香洲区昌业路90号,4.1,72,https://www.meituan.com/meishi/193742447/
简臻轻食,西餐,香洲区五洲世派街47号,3.5,61,https://www.meituan.com/meishi/194777665/
心海贝超级牛扒,西餐,香洲区前山路37号（翰林苑3栋2层商场）,3.9,58,https://www.meituan.com/meishi/161072939/
YOUNG 餐厅酒吧,西餐,香洲区昌盛路华发世纪城,4.4,44,https://www.meituan.com/meishi/165790976/
蛋壳披萨（奥园广场店）,西餐,香洲区梅界路奥园广场L2-39-1商铺,4.9,75,https://www.meituan.com/meishi/168922970/
馨语中西式茶餐厅,西餐,金湾区广安路137号中珠花园9栋1单元1号铺,4.2,54,https://www.meituan.com/meishi/170003120/
森啡西餐厅（三灶店）,西餐,金湾区三灶镇伟民路1号（伟民广场正对面，唐人街斜对面）,4.1,56,https://www.meituan.com/meishi/111899597/
尊宝比萨（五洲花城店）,西餐,香洲区山场路31号,4.3,88,https://www.meituan.com/meishi/112018021/
小姐姐披萨（拱北店）,西餐,香洲区迎宾南路摩尔广场后商业街2楼216号,5,15,https://www.meituan.com/meishi/177924003/
蛋壳披萨（信息港店）,西餐,香洲区唐家湾镇金唐东路99号珠海信息港2栋1层104-3,5,16,https://www.meituan.com/meishi/179383594/
梵间西餐厅·烧烤吧,西餐,香洲区翠珠四街51号蓝海金融大厦一层101号,3.3,95,https://www.meituan.com/meishi/183987375/
海湾大酒店·特色餐厅,西餐,香洲区水湾路北水湾路245号海湾大酒店二楼,3.5,56,https://www.meituan.com/meishi/184512882/
磨咖啡,西餐,斗门区井岸镇江湾中路266号（新徽幼儿园旁名城会所对面）,4.7,61,https://www.meituan.com/meishi/82134858/
Table Star星意面,西餐,斗门区中兴中路大信新都汇4楼西瑅书店旁,4,31,https://www.meituan.com/meishi/193705413/
简朴JEAN&PUAL现代法餐,西餐,香洲区景园路10号芝辰商务中心107铺（春兴酒家后面）,5,59,https://www.meituan.com/meishi/102864581/
金橡树咖啡,西餐,香洲区健民路183号,5,72,https://www.meituan.com/meishi/111337605/
嘟市基炸鸡汉堡（南水下金龙店）,西餐,金湾区高栏港经济区南水镇金龙联社下金龙路金龙村商铺1栋17.18号商铺,3.9,61,https://www.meituan.com/meishi/91007270/
SEVEN CLUB（新香洲创想公社店）,西餐,香洲区敬业路51号万科火花创想公社创意园一楼商铺A12号,3.4,58,https://www.meituan.com/meishi/194155220/
威尼斯牛扒美食城（新香洲店）,西餐,香洲区敬业路117号车·人·生活主楼2楼（君怡国际酒店旁）,3.5,44,https://www.meituan.com/meishi/159141585/
珍妮花园咖啡厅,西餐,香洲区景园路1号亿科商务中心一层108号商铺,4.6,75,https://www.meituan.com/meishi/159431668/
达芬奇厨房（扬名广场店）,西餐,香洲区凤凰南路1088号扬名广场二期5楼（岛之旅酒店直走进去）,4.7,54,https://www.meituan.com/meishi/119524919/
如院·烘焙咖啡轻食茶歇,西餐,香洲区会同南路会同村七巷1号,4.6,56,https://www.meituan.com/meishi/194996943/
珠海瑞吉酒店·秀餐厅,西餐,香洲区银湾路1663号珠海瑞吉酒店41层,3.5,15,https://www.meituan.com/meishi/182563042/
海鸿鲜蒸煮题餐厅（夏湾店）,聚餐宴请,香洲区昌平路春泽名园288、290、292号铺（老川坊对面）,5,44,https://www.meituan.com/meishi/50659794/
中山威尼斯西餐厅（珠海旗舰店）,聚餐宴请,香洲区粤海西路17号明珠山庄都会立方5楼（近三台石路、千鹤广场）,5,54,https://www.meituan.com/meishi/2523176/
万悦酒店·金厨泰国餐厅,聚餐宴请,香洲区水湾路28号万悦酒店4楼,5,75,https://www.meituan.com/meishi/40654155/
寻味民间顺德菜（吉大店）,聚餐宴请,香洲区情侣中路与吉大路交叉口德翰大酒店二楼,4.9,56,https://www.meituan.com/meishi/67471466/
魅力牛香·牛杂火锅（南屏旗舰店）,聚餐宴请,香洲区南湾北路45号南屏商业中心1F001、1F032号铺（弘桥商城侧）（南屏大桥巴士站右侧）,4.7,88,https://www.meituan.com/meishi/40097464/
龙发海鲜城,聚餐宴请,香洲区吉大景乐路平安大厦旁,4.9,15,https://www.meituan.com/meishi/1536375/
掂记风味餐厅河南家乡菜,聚餐宴请,香洲区拱北夏湾港昌路一掂就醉大堂右侧,5,95,https://www.meituan.com/meishi/70434087/
新粤穆斯林（新香洲店）,聚餐宴请,香洲区人民西路827号新疆大厦二楼,4.7,16,https://www.meituan.com/meishi/2515231/
大汗碳烤羊腿（三灶店）,聚餐宴请,金湾区映月路风水塘商业广场1层（凤鸣电影院旁边）,4.8,56,https://www.meituan.com/meishi/4468043/
印记·粤膳坊百姓厨房,聚餐宴请,香洲区翠微西路668号,4.3,61,https://www.meituan.com/meishi/51572688/
大三元大排档,聚餐宴请,横琴新区横琴宝中路26号（盈福楼门面）,4.7,31,https://www.meituan.com/meishi/40665843/
嘉远世纪酒店·品极轩海鲜酒楼,聚餐宴请,香洲区兰埔路216号（嘉远世纪酒店）,4.5,59,https://www.meituan.com/meishi/2437949/
湛王海鲜酒楼,聚餐宴请,香洲区湾仔海鲜街13号（近湾仔旅游码头）,5,72,https://www.meituan.com/meishi/1239275/
泰芒果（富华里店）,聚餐宴请,香洲区九洲大道西2033号中海富华里6栋1-07,4.6,58,https://www.meituan.com/meishi/40241365/
香港富临皇宫（扬名广场店）,聚餐宴请,香洲区凤凰南路1066号（扬名广场二期八楼）,3.8,61,https://www.meituan.com/meishi/40720925/
食神海鲜城（拱北店）,聚餐宴请,香洲区高沙中街108号南洋海景酒店1楼(近拱北汽车站),4.3,44,https://www.meituan.com/meishi/1235917/
柴火灶（井岸店）,聚餐宴请,斗门区井岸镇西堤路2801号,4.3,75,https://www.meituan.com/meishi/4458476/
金成记猪肚鸡（凤凰北店）,聚餐宴请,香洲区华海路70号（华润万家往海边200米左侧、华海花园小区正门对面）,4.3,54,https://www.meituan.com/meishi/41218579/
大横琴海鲜酒家（长隆接送）,聚餐宴请,横琴新区横琴新区宝兴路63-67号（横琴内有车接）,4,56,https://www.meituan.com/meishi/2509534/
海湾壹品,聚餐宴请,香洲区拱北水湾路245号海湾大酒店2楼,4.5,88,https://www.meituan.com/meishi/1524413/
月季轩,聚餐宴请,香洲区情侣南路305号景湾阁2层,4.1,15,https://www.meituan.com/meishi/1237412/
心语茶室（华海路店）,聚餐宴请,香洲区凤凰北华海路156号（晶都花园门市）,5,95,https://www.meituan.com/meishi/5686626/
共乐驿站·乡村stlye蒸汽主题餐厅,聚餐宴请,香洲区山房路94号（玲珑咖啡后面）,5,16,https://www.meituan.com/meishi/42133280/
昌记潮汕牛肉火锅店,聚餐宴请,香洲区乐园东路号海悦居14-18号铺（近鼎记猪肚鸡）,5,56,https://www.meituan.com/meishi/2214970/
淼福猪肚鸡（井岸店）,聚餐宴请,斗门区中兴中路31号（银城公交站旁）,4.1,61,https://www.meituan.com/meishi/65369713/
新成海鲜酒家,聚餐宴请,香洲区园林路69号（中国农业银行旁）,4.1,31,https://www.meituan.com/meishi/1237739/
万悦酒店·中餐厅,聚餐宴请,香洲区拱北水湾路28号万悦酒店22楼,4.4,59,https://www.meituan.com/meishi/40111100/
五饼二鱼·原味蒸汽火锅（香洲店）,聚餐宴请,香洲区洲山路23号综合楼（锦江之星）,4.5,72,https://www.meituan.com/meishi/40352298/
金湾食王（湾仔海鲜街店）,聚餐宴请,香洲区湾仔海鲜街18号,3.9,61,https://www.meituan.com/meishi/2214780/
金山林酒店·幸福园中餐厅（中餐厅）,聚餐宴请,金湾区机场大道西路366号C幢,3.9,58,https://www.meituan.com/meishi/40700801/
翠景湾脆鱼轩,聚餐宴请,斗门区井岸镇尖峰前路2号7幢309铺,5,44,https://www.meituan.com/meishi/6499156/
有鸡厨房（夏湾创始店）,聚餐宴请,香洲区夏湾粤华路329号（农业银行对面）,3.9,75,https://www.meituan.com/meishi/1238072/
福怡轩海鲜火锅酒楼,聚餐宴请,金湾区金荷路555号（贤德教育西30米）,3.7,54,https://www.meituan.com/meishi/41598138/
食神海鲜城（唐家店）,聚餐宴请,香洲区唐淇路437号鸡山综合楼（近港湾大道）,4,56,https://www.meituan.com/meishi/1236027/
华富美食大排档,聚餐宴请,香洲区粤华路225号《花苑新村11栋》可高德导航华富美食,3.5,88,https://www.meituan.com/meishi/6043655/
大厨小盏,聚餐宴请,香洲区上华路1号（中珠上城会所一楼）,3.9,15,https://www.meituan.com/meishi/41048140/
棕泉酒店东方御宴,聚餐宴请,香洲区夏湾侨光西路220号,3.7,95,https://www.meituan.com/meishi/2526938/
宝号鲍鱼（珠海店）,聚餐宴请,香洲区九洲大道东1248号（九洲假日公寓一楼101号）,4.9,16,https://www.meituan.com/meishi/1237707/
悦和庄餐厅,聚餐宴请,香洲区迎宾北路2042号（即拱北往遂道去香洲方向，迎宾北路交人民路口向前50米，南村东巴士站旁）,3.6,56,https://www.meituan.com/meishi/2441923/
龙禧渔村酒楼,聚餐宴请,香洲区银桦路48号c栋,4,61,https://www.meituan.com/meishi/52279050/
喜来登餐厅,聚餐宴请,金湾区三灶镇安堂村商业街A11号,3.5,31,https://www.meituan.com/meishi/68524206/
内蒙古炭烤羊腿（南屏店）,聚餐宴请,香洲区南屏坪岚路65号A1区域一楼5号商铺（南屏文化广场旁）,4.6,59,https://www.meituan.com/meishi/4215329/
皖江楼,聚餐宴请,香洲区吉大景乐路景林街6号（平安大厦旁）,4.4,72,https://www.meituan.com/meishi/42421785/
海龙宫饭店,聚餐宴请,金湾区272省道587乡道珠海机场旁,3.4,58,https://www.meituan.com/meishi/2782308/
湘厨私房菜（广生店）,聚餐宴请,香洲区珠海大道3023号（商业展销中心C）,3.8,61,https://www.meituan.com/meishi/2584798/
杨记海鲜餐厅,聚餐宴请,香洲区明珠北路24号-2栋-1层,4.2,44,https://www.meituan.com/meishi/2214540/
祥祺酒店豪宴酒楼,聚餐宴请,金湾区金湾路1号祥祺酒店三楼,3.9,54,https://www.meituan.com/meishi/6201327/
宁城驴庄,聚餐宴请,香洲区梅溪市场首层商铺（梅溪牌坊旁边）,4.3,75,https://www.meituan.com/meishi/6501819/
味之林（沿河路店）,聚餐宴请,香洲区沿河东路215号（为农市场巴士站旁）,4.1,56,https://www.meituan.com/meishi/1237478/
金成记猪肚鸡（888美食街店）,聚餐宴请,香洲区银桦路888街92号,3.5,88,https://www.meituan.com/meishi/40998673/
大宅门食府,聚餐宴请,香洲区前山上冲梅溪村梅溪牌坊侧,3.3,15,https://www.meituan.com/meishi/1236155/
森哥美食海鲜火锅（侨光路店）,聚餐宴请,香洲区侨光西路245号,3.9,16,https://www.meituan.com/meishi/41523358/
中邦艺术酒店中餐厅·沪粤轩,聚餐宴请,香洲区情侣中路33号中邦艺术酒店一楼（近吉大海滨泳场）,4.7,95,https://www.meituan.com/meishi/1237832/
湛府羊火锅,聚餐宴请,香洲区心华路132号,4.1,56,https://www.meituan.com/meishi/63410228/
大鱼湾农庄,聚餐宴请,香洲区屏北二路1号,4.1,61,https://www.meituan.com/meishi/6770387/
四季佳景酒家,聚餐宴请,香洲区珠海大道8号华发商都C馆4-5层C4001-C5001号铺,3.5,31,https://www.meituan.com/meishi/4095939/
乡村小园,聚餐宴请,斗门区珠峰大道东风广场旁（原添成庄园）,3.7,59,https://www.meituan.com/meishi/5878905/
毛家湾湘菜馆（斗门店）,聚餐宴请,斗门区江湾二路8、10号（上岛咖啡）,5,72,https://www.meituan.com/meishi/2215419/
常胜鲍鱼（吉大店）,聚餐宴请,香洲区石花东路海湾花园30栋105-109号,4.3,61,https://www.meituan.com/meishi/1235951/
金品记猪肚鸡酒楼（拱北总店）,聚餐宴请,香洲区粤海中路2300号丽枫酒店一楼（原四海酒店）,3.8,58,https://www.meituan.com/meishi/1239914/
鲜一派,聚餐宴请,金湾区红旗镇虹晖一路230号,4.6,44,https://www.meituan.com/meishi/40239329/
叠泉山庄,聚餐宴请,香洲区南湾北路人民法院执行局西约200米路南,4.3,75,https://www.meituan.com/meishi/2516140/
海之湾海鲜美食,聚餐宴请,香洲区情侣中路63号（珠海渔女停车场内）,3.5,54,https://www.meituan.com/meishi/6493114/
咱家饺子馆,聚餐宴请,香洲区九洲大道西2108号兰埔花园259号,4.4,56,https://www.meituan.com/meishi/6831327/
嘎嘎香东北菜,聚餐宴请,香洲区怡华街72号（近体育中心西门，富康花园美食街）,4,15,https://www.meituan.com/meishi/2214064/
豆花饭店,聚餐宴请,斗门区新堂路14号（合意商业楼B1栋18号，合意酒店旁）,3.9,88,https://www.meituan.com/meishi/40818224/
红树轩餐饮,聚餐宴请,香洲区前河西路333号中信红树湾9栋1楼,3.8,95,https://www.meituan.com/meishi/42360470/
湘王,聚餐宴请,香洲区水湾路159-161号,4.2,16,https://www.meituan.com/meishi/42782652/
欧麦蛋糕（前山店）,聚餐宴请,香洲区明珠南路金福广场2117号铺（明珠中巴士站旁）,4.2,56,https://www.meituan.com/meishi/5929552/
皇鸽餐厅,聚餐宴请,香洲区明珠南路1125号（明珠商业广场前300米）,4.5,61,https://www.meituan.com/meishi/71564124/
五谷香湘菜馆（南水店）,聚餐宴请,金湾区南水镇4号楼1楼,3.8,31,https://www.meituan.com/meishi/1238540/
老北京风味,聚餐宴请,香洲区九州大道1312号（云海酒店对面）,3.9,59,https://www.meituan.com/meishi/1235986/
九十音乐酒馆（香洲店）,聚餐宴请,香洲区先烈路先烈巷1号2栋1号（翡翠宫酒店旁）,4.1,72,https://www.meituan.com/meishi/5018055/
聚佳餐厅（拱北店）,聚餐宴请,香洲区拱北粤华路新市花园侧（大家乐背后）,4.3,58,https://www.meituan.com/meishi/2214382/
湘攸大碗菜（吉大店）,聚餐宴请,香洲区吉大洲仔食街情侣南路356号,4.2,61,https://www.meituan.com/meishi/1236001/
翠微茶楼饭店,聚餐宴请,香洲区明珠南路3062号（月主题酒店后面）,3.3,44,https://www.meituan.com/meishi/4543204/
高登海鲜城,聚餐宴请,金湾区平沙升平大道东22号一楼,4.1,75,https://www.meituan.com/meishi/1238580/
仙庙烧鸡（南屏店）,聚餐宴请,"香洲区南屏镇屏东六路76号（蓝山酒店一楼,南屏派出所斜对面）",4.1,54,https://www.meituan.com/meishi/64155203/
万州烤鱼（昌平路店）,聚餐宴请,香洲区夏湾昌平路61号（华苑花园大门旁边）,4.4,56,https://www.meituan.com/meishi/6271796/
四川简阳原汤羊肉火锅,聚餐宴请,香洲区翠珠三街1号（翠微电脑城后）,4.5,15,https://www.meituan.com/meishi/4921222/
手指公海鲜美食,聚餐宴请,香洲区情侣中路53号,3.7,88,https://www.meituan.com/meishi/1237617/
果度大排档（横琴长隆店）,聚餐宴请,横琴新区宝兴路45-47号（长隆附近有车接）,3.6,95,https://www.meituan.com/meishi/40994489/
杨记海鲜酒楼（海鲜街店）,聚餐宴请,香洲区湾仔海鲜街15号（近湾仔体育休闲公园）,3,16,https://www.meituan.com/meishi/1238058/
大自然农庄,聚餐宴请,斗门区黄杨大道与工业大道西行100米（近井岸二桥，高速底下）,3.8,56,https://www.meituan.com/meishi/6634718/
龙宝轩海鲜火锅酒家,聚餐宴请,香洲区迎宾北路南村豪苑东门底商,3.9,61,https://www.meituan.com/meishi/1240564/
牛一锅·牛肉火锅,聚餐宴请,香洲区吉大九洲大道东绿茵豪庭楼下老树咖啡旁,4,31,https://www.meituan.com/meishi/6989979/
俊兴大排档（长隆店）,聚餐宴请,横琴新区横琴镇宝兴路43号,3.4,59,https://www.meituan.com/meishi/52006002/
海南羊庄私房菜（上冲店）,聚餐宴请,香洲区上冲村新西街38号4栋1层2号（近上冲工业区）,5,72,https://www.meituan.com/meishi/41842378/
顺德醉鹅广西牛杂煲,聚餐宴请,斗门区工业大道25号（新廖记食店正对面，新鸿酒店斜对面）,4.1,61,https://www.meituan.com/meishi/2215554/
红叶美食广场,聚餐宴请,金湾区榕月路158号（三阳商业广场处）,4.2,58,https://www.meituan.com/meishi/64726697/
李世霸王牛肉火锅主题餐厅（珠海店）,聚餐宴请,香洲区金鸡路左右创意园内,4,44,https://www.meituan.com/meishi/65361425/
龙坛山庄,聚餐宴请,斗门区龙西村港霞西路龙坛水淋泵2号（即实验中学旁龙坛村口）,4.7,54,https://www.meituan.com/meishi/2536087/
赣香猪肚鸡火锅,聚餐宴请,金湾区金岛路205号（金海岸中学对面）,4,75,https://www.meituan.com/meishi/2215475/
SKY BAR天空吧,聚餐宴请,香洲区南屏BOX文化创意区俪栈酒店五楼,3.7,56,https://www.meituan.com/meishi/188874617/
老地方生蚝海鲜小炒,聚餐宴请,香洲区拱北莲花路161号右侧B商铺,3.5,15,https://www.meituan.com/meishi/192526377/
阿贵大饭店,聚餐宴请,斗门区斗门区黄杨大道排山路口（金台立交下高速往西方向）,4,88,https://www.meituan.com/meishi/193985840/
贰麻酒馆珠海斗酒场,聚餐宴请,香洲区拱北水湾路酒吧街222号,5,95,https://www.meituan.com/meishi/610539880/
俊兴蚝港海鲜酒楼,聚餐宴请,横琴新区横琴新区红旗村宝兴路101号立体停车场对面,4,16,https://www.meituan.com/meishi/2215101/
东升脆肉鲩专卖店（斗门店）,聚餐宴请,斗门区湖心路商业街70号（鳄鱼岛对面）,5,56,https://www.meituan.com/meishi/72090206/
火宫殿（拱北店）,聚餐宴请,香洲区粤海东路粤海酒店二楼（莲花路粤海大酒店）,5,61,https://www.meituan.com/meishi/73390734/
新顺昌休闲餐厅,聚餐宴请,斗门区斗门大道北280号（财政所对面）,3.5,31,https://www.meituan.com/meishi/90006003/
惹味烧烤场,聚餐宴请,香洲区唐家湾镇金鼎那洲农贸市场西50米（古元文化广场内）,3,59,https://www.meituan.com/meishi/90589324/
明珠濠苑海鲜酒楼,聚餐宴请,香洲区梅华东路190号华南名宇1-7号商铺,5,72,https://www.meituan.com/meishi/107529147/
潮汕海鲜大排档,聚餐宴请,香洲区南屏泰南街34号一楼1号铺,3,58,https://www.meituan.com/meishi/159082924/
百磨坊（斗门店）,聚餐宴请,斗门区中兴南路396号（华润银行隔壁）,4.9,61,https://www.meituan.com/meishi/155797969/
金利元,聚餐宴请,香洲区环屏路14-16号（珠海南屏BOX玩文化创意园3栋2楼）,0,44,https://www.meituan.com/meishi/160699844/
悦来海鲜餐厅,聚餐宴请,金湾区映月路,0,54,https://www.meituan.com/meishi/169464448/
大厨海鲜城,聚餐宴请,金湾区南涌路赋晖华庭63号（九龙酒店斜对面）,4.2,75,https://www.meituan.com/meishi/177545949/
横琴神箭山莊,聚餐宴请,横琴新区横琴新区深井村5号,5,56,https://www.meituan.com/meishi/177943054/
中桥餐馆,聚餐宴请,香洲区香洲区广昌双城汇104D区,3.5,88,https://www.meituan.com/meishi/182422282/
仁恒洲际酒店彩丰楼中餐厅,聚餐宴请,香洲区情侣南路珠海仁恒洲际酒店4楼,5,15,https://www.meituan.com/meishi/184987346/
清远鸡煲猪肚鸡纸上烤鱼火焰醉鹅（井岸店）,聚餐宴请,斗门区斗门区江湾中路308号,3.8,16,https://www.meituan.com/meishi/185589120/
鑫淼猪肚鸡（斗门大道店）,聚餐宴请,斗门区斗门区斗门大道龙山酒店旁,4.1,95,https://www.meituan.com/meishi/187859627/
雲味轩,聚餐宴请,香洲区屏北二路攀云购物公园一楼103号（汉庭酒店正后方）,3.7,56,https://www.meituan.com/meishi/190928221/
有福气猪肚鸡（金鼎店）,聚餐宴请,香洲区金鼎镇宁堂村6号,4.4,61,https://www.meituan.com/meishi/99081790/
福鑫猪肚鸡,聚餐宴请,斗门区斗门区272省道中兴中路2号,4.3,31,https://www.meituan.com/meishi/191296486/
横琴秀姐农庄,聚餐宴请,香洲区环岛东路,3.8,59,https://www.meituan.com/meishi/194446387/
九十音乐中餐厅,聚餐宴请,香洲区凤凰南路1180号（扬名广场旁边）,5,72,https://www.meituan.com/meishi/157335098/
玉兴潮味海鲜酒楼,聚餐宴请,香洲区前山东门街176号,5,58,https://www.meituan.com/meishi/195219289/
真不同东北菜春饼水饺（明珠店）,聚餐宴请,香洲区前信街136号（京华奥园B区，前山邮局后面）,3.5,61,https://www.meituan.com/meishi/825478985/
添顺饭店,聚餐宴请,横琴新区横琴长隆海河街34号（长隆有车接）,4.1,44,https://www.meituan.com/meishi/61849877/
三福潮州砂锅粥,聚餐宴请,香洲区夏湾华平路10-4号商铺,4.7,75,https://www.meituan.com/meishi/118995928/
爱尚牛鼎记·潮汕牛肉火锅（横琴中央汇店）,聚餐宴请,香洲区香江路10号横琴中央汇商业街一楼,4.8,54,https://www.meituan.com/meishi/114032392/
悦鸿轩酒楼,聚餐宴请,香洲区前山界涌工北街33号,3.7,56,https://www.meituan.com/meishi/116466814/
和轩（南水店）,聚餐宴请,金湾区南水镇同心路南水餐饮商业街,5,15,https://www.meituan.com/meishi/152320899/
何记风味菜馆,聚餐宴请,香洲区怡华街10号A商铺（许生粥坊旁）,5,88,https://www.meituan.com/meishi/99309579/
共乐烧鸡,聚餐宴请,香洲区山房路120号（唐家共乐园正门往前150米左侧）,4.6,16,https://www.meituan.com/meishi/158853951/
文兴酒家（富华里店）,聚餐宴请,香洲区九洲大道西2033号中海富华里3栋3-01,3.3,95,https://www.meituan.com/meishi/162133002/
海呀咪海鲜大咖主题餐厅,聚餐宴请,香洲区环屏路16号BOX创意区2栋2楼,4,56,https://www.meituan.com/meishi/162870215/
龙记牧牛轩,聚餐宴请,香洲区景乐路16号（龙发海鲜城后侧）,0,61,https://www.meituan.com/meishi/164993796/
顺德火焰醉鹅坊,聚餐宴请,香洲区洲山路4号中侨兴商业大厦一楼（天鹅酒店直入200米右手边）,4.7,31,https://www.meituan.com/meishi/81427253/
英姐海鲜大排档,聚餐宴请,金湾区白藤头水产批发市场,3.5,59,https://www.meituan.com/meishi/166024618/
