餐厅名,种类,地址,评分,人均,链接
北纬22°（家和城店）,蛋糕甜点,斗门区斗门区湖心路1098号家和城广场三层A–01号铺,3.5,58,https://www.meituan.com/meishi/188415846/
BOBA MIX混搭珍珠（摩尔店）,蛋糕甜点,香洲区迎宾南路2095号商场负一层B-013号（迪卡侬楼下）,4.1,44,https://www.meituan.com/meishi/165967991/
榴芒嘿客蛋糕（红旗店）,蛋糕甜点,金湾区珠职业学院二饭一楼,4.2,54,https://www.meituan.com/meishi/163339374/
Sanpo,蛋糕甜点,斗门区井岸镇南潮新村二巷1号1号铺位,3.5,75,https://www.meituan.com/meishi/160716952/
浓心爷爷（拱北口岸店）,蛋糕甜点,香洲区拱北停车场收费处临时铺位015号（即拱北口岸商场北二门出口正对面）,5,56,https://www.meituan.com/meishi/190786728/
梦幻千层蛋糕,蛋糕甜点,金湾区藤山路137号,4.4,15,https://www.meituan.com/meishi/82235566/
面包小将（美丽湾店）,蛋糕甜点,香洲区神前路9号商铺,3,88,https://www.meituan.com/meishi/168480152/
喜凤梨（扬名广场店）,蛋糕甜点,香洲区凤凰南路1066号（扬名广场二期负一层）,3.6,95,https://www.meituan.com/meishi/169053040/
同学仔茶餐厅,蛋糕甜点,斗门区白蕉镇同心路赖家管理区中心南43号（白蕉中心小学）,3,16,https://www.meituan.com/meishi/158951368/
茶语欧麦（斗门店）,蛋糕甜点,斗门区中兴南路110号（大叔茶餐厅旁）,4.4,56,https://www.meituan.com/meishi/195981660/
皇茶（虎山店）,蛋糕甜点,斗门区乾务镇虎山村虎山市场2号,3.5,61,https://www.meituan.com/meishi/163406506/
西美喜,蛋糕甜点,香洲区明珠南路2051号,4.7,31,https://www.meituan.com/meishi/1698216045/
Royalstea皇茶,蛋糕甜点,斗门区井岸镇江湾二路206号铺,4.8,59,https://www.meituan.com/meishi/97113922/
沏茶（沿河东路店）,蛋糕甜点,香洲区香洲沿河东路249号,5,72,https://www.meituan.com/meishi/110251787/
竹苑四海咖喱鱼蛋（迎宾南路4店）,蛋糕甜点,香洲区迎宾南路1003号口岸购物广场B1层D区莱富士时尚购物商场D1309号铺（拱北口岸地下商场）,4.6,61,https://www.meituan.com/meishi/169309144/
黄氏许牛奶甜品专家,蛋糕甜点,香洲区昌业路96号商铺,4.4,58,https://www.meituan.com/meishi/169052211/
文化创意后花园咖啡厅,蛋糕甜点,香洲区板樟山森林公园,5,44,https://www.meituan.com/meishi/135075195/
黄氏宗轩养生甜品专家（金鼎店）,蛋糕甜点,香洲区鸿新街3号之三商铺（潮记煲仔饭对面）,3.6,54,https://www.meituan.com/meishi/169539443/
芋观园（横琴中央汇店）,蛋糕甜点,香洲区香江路10号横琴中央汇商业街一楼,3,75,https://www.meituan.com/meishi/162956687/
澳门雍记甜品（珠海分店）,蛋糕甜点,香洲区凤凰北路1035号（一小旁边）,4.2,56,https://www.meituan.com/meishi/163312090/
心语鲜果千层蛋糕店（红旗店）,蛋糕甜点,金湾区文华路世纪名城小区门面,5,15,https://www.meituan.com/meishi/88998752/
糖山小屋,蛋糕甜点,香洲区南屏镇北山巷糖山小屋（北山大院停车场旁巷子直走50米）,5,88,https://www.meituan.com/meishi/160319198/
小确茶,蛋糕甜点,香洲区柠溪路柠溪公交站附近,4.5,95,https://www.meituan.com/meishi/170605438/
CHEERS CHEESE 干杯起司（三灶店）,蛋糕甜点,金湾区金海岸大道西257号1栋108号商铺（唐人街市场后面）,3.5,16,https://www.meituan.com/meishi/169333200/
新加坡妈妈烤包（奥园广场店）,蛋糕甜点,香洲区梅界路珠海奥园广场自编L4-09A号商铺,3.5,56,https://www.meituan.com/meishi/174891163/
Regiustea天御皇茶（华发商都店）,蛋糕甜点,香洲区珠海大道8号（华发商都A馆三楼）,4.3,61,https://www.meituan.com/meishi/119451150/
启达西饼生日蛋糕（香洲店）,蛋糕甜点,香洲区心华路52号商铺之二（富康花园底商）,4,31,https://www.meituan.com/meishi/174917883/
cremeux可蜜法式甜品,蛋糕甜点,香洲区北山正街北五巷三号（北山会馆旁）,5,59,https://www.meituan.com/meishi/159865756/
茗糖甜品（南屏分店）,蛋糕甜点,香洲区BOX创意区2号楼1010档口（电梯旁）,4.8,72,https://www.meituan.com/meishi/175344975/
INCHA印茶（奥园广场店）,蛋糕甜点,香洲区梅界路187号梅溪奥园广场1048号商铺,4.1,61,https://www.meituan.com/meishi/171866810/
答案茶 ANSWER TEA（兰圃创意店）,蛋糕甜点,香洲区兰埔路152号,4.1,58,https://www.meituan.com/meishi/175373674/
禧御贡茶（莲花路店）,蛋糕甜点,香洲区粤华路135号（拱北市场对面）,5,44,https://www.meituan.com/meishi/162061182/
蜜雪冰城（珠海学院店）,蛋糕甜点,金湾区三灶镇590县道海澄安堂村商业街第一栋第一层惠雅超市门前B7号,3.5,75,https://www.meituan.com/meishi/175483854/
喝喝·一杯专属你的茶（诚丰广场店）,蛋糕甜点,香洲区明珠南路1101号（诚丰广场负一层，正新鸡排旁）,4.1,54,https://www.meituan.com/meishi/175500100/
bittersweet走糖（吉大店）,蛋糕甜点,香洲区吉大街道水湾路279号海怡大厦一层（南油酒店斜对面街）,4.4,56,https://www.meituan.com/meishi/86296428/
遇见茶吧,蛋糕甜点,香洲区环屏路17号,3.5,88,https://www.meituan.com/meishi/177739041/
悟茶（拱北口岸店）,蛋糕甜点,香洲区昌盛路迎宾南路1003号,3.6,15,https://www.meituan.com/meishi/177765099/
宫廷贡茶,蛋糕甜点,香洲区人民西路与安富路交叉口宁兴大厦底商,5,16,https://www.meituan.com/meishi/159146428/
正点●贡茶（拱北口岸店）,蛋糕甜点,香洲区拱北口岸地下商场莱富士D1208A铺（东北门方向直走）,4.2,95,https://www.meituan.com/meishi/98373736/
嚮茶（响茶摩尔广场店）,蛋糕甜点,香洲区拱北摩尔广场一楼（沃尔玛迎宾南路与岭南路交界处入口）,4.1,56,https://www.meituan.com/meishi/97391863/
竹苑咖喱叔（汇优城店）,蛋糕甜点,香洲区香洲兴业路23号丹田城市广场4楼（动力国际健身）,5,61,https://www.meituan.com/meishi/109813885/
心美乐（井岸店）,蛋糕甜点,斗门区中兴南路364号（大快面附近）,4.6,31,https://www.meituan.com/meishi/97416324/
贡茶（宝地康泰店）,蛋糕甜点,香洲区红宝路44号之五（车咖旁）,5,59,https://www.meituan.com/meishi/110452450/
芒奇奇手作糯米糍,蛋糕甜点,香洲区南湾北路珠海BOX玩文化创意区1023铺,3.9,72,https://www.meituan.com/meishi/179302179/
果鲜道私房甜品,蛋糕甜点,香洲区鞍莲路11号商铺（财富世家3号门）,5,61,https://www.meituan.com/meishi/158691748/
海马十里茶颜（富华里店）,蛋糕甜点,香洲区九洲大道西2033号中海富华里品汇B1-116A,4.3,58,https://www.meituan.com/meishi/161852107/
顺德双皮奶（石花西路店）,蛋糕甜点,香洲区石花西路251号,3.7,44,https://www.meituan.com/meishi/190781827/
High tea三點三,蛋糕甜点,斗门区中兴南路（顺客隆农业银行巴士站旁边）,5,54,https://www.meituan.com/meishi/160564607/
雾鲜（柠溪店）,蛋糕甜点,香洲区柠溪路284号（柠溪文化广场C区中影火星湖电影院会员专区B区）,4.5,75,https://www.meituan.com/meishi/181549133/
品味东北冰糕,蛋糕甜点,香洲区香洲区兴柠街60号,3.5,56,https://www.meituan.com/meishi/182111102/
蜜雪冰城（海华7栋店）,蛋糕甜点,香洲区北京师范大学珠海校区海7一楼5号铺,4,15,https://www.meituan.com/meishi/182111860/
TONOLO托诺洛·提拉米苏,蛋糕甜点,香洲区白莲路千帆广场白沙河时光街区三期15号铺,4.5,88,https://www.meituan.com/meishi/192864749/
雪芋仙,蛋糕甜点,斗门区井岸镇江湾二路162号,4.4,16,https://www.meituan.com/meishi/159563140/
垚燚1点点,蛋糕甜点,香洲区夏湾路224号,0,95,https://www.meituan.com/meishi/193283891/
仁恒洲际酒店·桥吧大堂吧,蛋糕甜点,香洲区情侣南路珠海仁恒洲际酒店2楼,3.3,56,https://www.meituan.com/meishi/185009573/
PROJECT D,蛋糕甜点,香洲区柠溪路284号柠溪文化广场4楼412-413,3.5,61,https://www.meituan.com/meishi/194564438/
一股甜·爆浆鸡蛋糕（鳳凰北店）,蛋糕甜点,香洲区凤凰北路1118号A5商铺（凤凰北路与翠香路天桥下）,5,31,https://www.meituan.com/meishi/183986434/
浓心爷爷（北师大UIC店）,蛋糕甜点,香洲区高新区唐家湾镇金同路2000号T2-106商铺,0,59,https://www.meituan.com/meishi/194997096/
特蕊可法式西餐烘焙,蛋糕甜点,金湾区曼哈顿酒店一楼特蕊可西餐厅（虹晖一路50号）,3.9,72,https://www.meituan.com/meishi/1286111595/
古春堂凉茶甜品（家和城店）,蛋糕甜点,斗门区学府街家和城2期284号商铺,3.5,61,https://www.meituan.com/meishi/1841429700/
源记传承,蛋糕甜点,香洲区先烈路29号之一,5,58,https://www.meituan.com/meishi/115230568/
幕然贡茶,蛋糕甜点,香洲区金鸡路7号左右创意园1栋2楼,0,44,https://www.meituan.com/meishi/150430855/
欧包与茶（迎宾南路店）,蛋糕甜点,香洲区迎宾南路2038号（辣神串串火锅旁）,0,54,https://www.meituan.com/meishi/164442566/
花澗茶客（扬名店）,蛋糕甜点,香洲区凤凰南路1088号一期与二期通道尽头左拐,3.2,75,https://www.meituan.com/meishi/189458887/
STREET CUP 街杯（瑞府店）,蛋糕甜点,香洲区新香洲岭南世家·瑞府,4.1,56,https://www.meituan.com/meishi/164608744/
花澗茶客（吉大园林店）,蛋糕甜点,香洲区园林路28号（日东花园东南门附近）,5,88,https://www.meituan.com/meishi/185257911/
叻叻SoGood·饮品·简餐,蛋糕甜点,香洲区园林路景乐路51号,3.5,15,https://www.meituan.com/meishi/170660420/
炖皇椰,蛋糕甜点,香洲区夏湾路346号,5,16,https://www.meituan.com/meishi/174956146/
Time TABLE研磨时光咖啡,蛋糕甜点,香洲区明珠南路2021号（大前门一楼）,3.8,95,https://www.meituan.com/meishi/185973976/
憩盒（格力海岸店）,蛋糕甜点,香洲区格力海岸商业街13栋107、211号,4.2,56,https://www.meituan.com/meishi/193166751/
简也-鲜奶泡泡茶（南屏店）,蛋糕甜点,香洲区南湾北路南屏BOX创意园3栋1楼1014-1号,4.5,61,https://www.meituan.com/meishi/193785137/
珠海瑞吉酒店·瑞吉酒廊,蛋糕甜点,香洲区银湾路1663号珠海瑞吉酒店41层,4.5,31,https://www.meituan.com/meishi/182559511/
蜜萨奇榴莲披萨,蛋糕甜点,金湾区藤荣路世纪名城141号商铺,4.5,59,https://www.meituan.com/meishi/71877261/
顺德双皮奶（吉大免税店）,蛋糕甜点,香洲区吉大免税商场二楼后门电梯口（二楼客户服务中心对面）,4.6,72,https://www.meituan.com/meishi/194533477/
take me away,蛋糕甜点,香洲区明珠南路1123号,5,61,https://www.meituan.com/meishi/187143615/
鲜芋仙（尚都百货店）,蛋糕甜点,香洲区凤凰南路1168号（尚都百货）一楼8号铺,4.1,58,https://www.meituan.com/meishi/193804964/
亲爱的蜂蜜茶Honey tea,蛋糕甜点,香洲区九洲大道中1098号（中电大厦2号楼）,3.9,44,https://www.meituan.com/meishi/194708039/
CHEERS CHEESE 干杯起司（扬名广场店）,蛋糕甜点,香洲区翠海路6-3号（扬名广场二期地下停车场出口正对面）,4.4,75,https://www.meituan.com/meishi/195807170/
Royaltea皇茶（拱北口岸店）,蛋糕甜点,香洲区昌盛路拱北口岸广场负一层大堂（我很懒旁边）,5,54,https://www.meituan.com/meishi/98258591/
Mr.水濑海鲜放题,自助餐,香洲区紫荆路301号茂业百货6楼,4.5,44,https://www.meituan.com/meishi/184400759/
蒙肥羊自助餐厅（香洲店）,自助餐,香洲区凤凰南路1130号马可波罗大厦2楼（吉之岛旁，肯德基楼上）,5,54,https://www.meituan.com/meishi/1238743/
西町果木牛扒自助餐厅（前山店）,自助餐,香洲区前山明珠南路1953号四栋二城商业广场4楼,5,75,https://www.meituan.com/meishi/189271467/
仟盛创作料理,自助餐,香洲区狮山路12号,5,56,https://www.meituan.com/meishi/164682444/
圣琼美食汇-海鲜自助餐厅（吉大店）,自助餐,香洲区吉大路2号（国际会议中心裙楼2层，吉大汽车总站旁）,4.5,15,https://www.meituan.com/meishi/4243256/
珠海来魅力假日酒店海鲜自助餐,自助餐,香洲区围基路32号（拱北口岸广场对面）,4.7,88,https://www.meituan.com/meishi/1239484/
后宫烧（前山店）,自助餐,香洲区粤海西路46号,4.5,16,https://www.meituan.com/meishi/182438158/
圣琼美食百汇（香洲店）,自助餐,香洲区紫荆路189号（金宝路商业广场四楼）,4.3,95,https://www.meituan.com/meishi/1442272/
后宫烧（吉大店）,自助餐,香洲区海滨南路45号,4.5,56,https://www.meituan.com/meishi/193140061/
西町果木牛排自助餐厅,自助餐,香洲区凤凰南路1066号扬名广场2期6楼,4.5,61,https://www.meituan.com/meishi/179446402/
怡景湾大酒店●怡风西餐厅,自助餐,香洲区情侣中路47号（怡景湾大酒店四楼）,4.3,31,https://www.meituan.com/meishi/1236117/
一本魅·无国界海鲜放题料理,自助餐,香洲区昌盛路龙珠达国际酒店二楼（轻轨珠海站正对面）,4.7,59,https://www.meituan.com/meishi/163128793/
海湾大酒店加·咖啡西餐厅,自助餐,香洲区水湾路245号（海湾大酒店一楼）,5,72,https://www.meituan.com/meishi/1236163/
鱼你相约·火山喷泉锅,自助餐,香洲区明珠南路1953号二城商业广场4楼,4.5,61,https://www.meituan.com/meishi/193651710/
四知缘素食自助餐,自助餐,香洲区敬业路148号（旺角广场前红路灯处往北行走50米靠右边）,4.7,58,https://www.meituan.com/meishi/61350469/
常乐轩素食自助馆,自助餐,香洲区夏美路一巷17号,4.7,44,https://www.meituan.com/meishi/62575992/
圣琼美食百汇（尚都百货店）,自助餐,香洲区凤凰南路1168号（尚都百货四楼）,4,54,https://www.meituan.com/meishi/162934669/
慈光海利蔬食馆,自助餐,香洲区粤华路夏湾新海利美食广场,4.4,75,https://www.meituan.com/meishi/164047558/
维利亚自助美食汇,自助餐,香洲区迎宾南路迎宾广场内二楼中庭（由麦当劳旁正门内二楼）,3.9,56,https://www.meituan.com/meishi/5382995/
和亭日本料理（红旗店）,自助餐,金湾区红旗镇虹晖一路232号铺（中心广场旁）,3.6,15,https://www.meituan.com/meishi/6325815/
圣琼美食百汇（井岸店）,自助餐,斗门区新民路步行街南天百货三楼,3.5,88,https://www.meituan.com/meishi/152783637/
老山城怀旧火锅,自助餐,香洲区粤海东路1145号,4.3,95,https://www.meituan.com/meishi/193115062/
札幌水产放题,自助餐,香洲区侨光路37号（国泰酒店一楼）,0,16,https://www.meituan.com/meishi/953249878/
西町果木牛扒自助餐厅（拱北店）,自助餐,香洲区迎宾南路1081号中珠大厦东亚银行3楼,4.1,56,https://www.meituan.com/meishi/1648073152/
发嫂养生素食自助餐,自助餐,香洲区拱北莲花路（来魅力女人世界2A）,4,61,https://www.meituan.com/meishi/50867581/
庆华国际大酒店·雅典西餐厅,自助餐,香洲区吉大情侣南路309号（庆华国际大酒店一楼）,4.2,31,https://www.meituan.com/meishi/1237833/
粤海璇宫,自助餐,香洲区粤海东路1145号粤海酒店29楼,4.1,59,https://www.meituan.com/meishi/1239480/
素缘素食自助餐,自助餐,香洲区景山路珠海百货广场四楼,4.1,72,https://www.meituan.com/meishi/91763687/
长隆马戏酒店自助餐厅,自助餐,横琴新区长隆大道马戏酒店3楼,4.3,61,https://www.meituan.com/meishi/40744360/
沁莲素食自助,自助餐,香洲区翠微东路68号君临酒店3楼,4.2,58,https://www.meituan.com/meishi/52563274/
珠海瑞吉酒店·瑞吉酒廊,自助餐,香洲区银湾路1663号珠海瑞吉酒店41层,4.5,44,https://www.meituan.com/meishi/182559511/
长隆企鹅酒店·帝企鹅自助餐厅,自助餐,横琴新区长隆大道长隆国际海洋度假区企鹅酒店大堂层,3.9,54,https://www.meituan.com/meishi/40461682/
五洲佳肴自助美食汇,自助餐,斗门区井岸镇港霞东路98号（南国商场4楼）,3.3,75,https://www.meituan.com/meishi/6887537/
珠海凤凰湾悦椿酒店·食集西餐厅,自助餐,香洲区泉星东路凤凰湾悦椿酒店一楼,3.7,56,https://www.meituan.com/meishi/175256909/
长隆横琴湾酒店海豚自助餐厅,自助餐,横琴新区长隆横琴湾酒店,3.6,15,https://www.meituan.com/meishi/6538123/
乐享缤纷,自助餐,金湾区平沙镇美平东路285号之四、五铺（长春药店旁）,3.5,88,https://www.meituan.com/meishi/157067111/
来魅力假日酒店·魅力观光酒廊,自助餐,香洲区拱北围基路32号来魅力假日酒店23楼,3.5,16,https://www.meituan.com/meishi/1546913565/
鲜悦道海鲜自助餐,自助餐,香洲区南屏南湾北路32号V12文化创意园二栋（南屏大桥巴士站旁，碧湾酒店、野猫酒吧对面）,3.5,95,https://www.meituan.com/meishi/42359874/
西洋会▪中国吧▪西餐扒屋,自助餐,香洲区水湾路酒吧街203-209号,4,56,https://www.meituan.com/meishi/1235789/
珠海华发喜来登酒店·Feast全日餐厅,自助餐,香洲区湾仔银湾路1663号珠海华发喜来登酒店三层（珠海国际会展中心）,3.3,61,https://www.meituan.com/meishi/86606748/
新骏景万豪酒店●都会尚膳西餐厅,自助餐,香洲区景山路177号9栋（新骏景万豪酒店二楼）,3.2,31,https://www.meituan.com/meishi/92313942/
中海铂尔曼酒店·品坊全日制餐厅,自助餐,香洲区九洲大道西2029号珠海中海铂尔曼酒店5层（富华里综合体内）,3.8,59,https://www.meituan.com/meishi/40708492/
仁恒洲际酒店·悦全日餐厅,自助餐,香洲区情侣南路仁恒洲际酒店2楼,3,72,https://www.meituan.com/meishi/181431573/
金草帽韩式烧烤（华发商都分店）,自助餐,香洲区珠海大道8号华发商都A馆1号楼3层A3001号商铺,3.4,61,https://www.meituan.com/meishi/5762376/
桃花朵朵餐厅,自助餐,香洲区横琴镇粗沙环5号,3.5,58,https://www.meituan.com/meishi/164598787/
汤响自助回转火锅（天虹商场店）,自助餐,香洲区明珠南路1101号天虹商场负一楼（天虹超市入口旁）,3.4,44,https://www.meituan.com/meishi/113868130/
粤海璇宫SKY29音乐餐吧,自助餐,香洲区粤海东路1145号粤海酒店29楼,3,54,https://www.meituan.com/meishi/193681850/
澳门鲜味王（拱北店）,自助餐,香洲区侨光路169号（近宝裕美食街）,3.7,75,https://www.meituan.com/meishi/192740498/
水日本料理,自助餐,横琴新区珠海长隆横琴湾酒店海豚区一楼（长隆海洋王国）,4,56,https://www.meituan.com/meishi/138809766/
珠海瑞吉酒店·秀餐厅,自助餐,香洲区银湾路1663号珠海瑞吉酒店41层,3.5,15,https://www.meituan.com/meishi/182563042/
汉釜宫韩式烤肉,自助餐,香洲区明珠南路大前门三楼,3,88,https://www.meituan.com/meishi/187542713/
朱记小龙虾香辣蟹,小吃快餐,香洲区景莲街9号（近凌波酒店）,3.7,44,https://www.meituan.com/meishi/192073442/
煲煲赞煲仔饭（新香洲店）,小吃快餐,香洲区昌业路58号（回家湘对面/十二小学斜对面）,5,54,https://www.meituan.com/meishi/41309168/
汉堡王（珠海华发商都店）,小吃快餐,香洲区珠海大道8号华发商都D馆1层B1001,4.3,75,https://www.meituan.com/meishi/5593705/
晓滋味十三香小龙虾,小吃快餐,香洲区粤华路504号,5,56,https://www.meituan.com/meishi/194536924/
华莱士（明珠店）,小吃快餐,香洲区明珠北路44号（城轨明珠站A出口）,4.2,88,https://www.meituan.com/meishi/40550359/
臭味香透臭豆腐（前山店）,小吃快餐,香洲区明珠南路2145号翠景花园翠景商铺（翠景工业区公交站后往香洲方向，早8点超市旁边）,4.6,15,https://www.meituan.com/meishi/5493665/
黑白冰室,小吃快餐,香洲区心华路42号富康花园96号商铺,4,95,https://www.meituan.com/meishi/194675749/
汉堡王（珠海世纪城店）,小吃快餐,香洲区昌盛路376号华发世纪城一层2区2105号及二层2206号铺,4.2,16,https://www.meituan.com/meishi/5908372/
金淮老鸭粉丝汤馆1（圆明新园店）,小吃快餐,香洲区兰埔路229号湖光山色3号铺（梦幻水城正门斜对面）,4.6,56,https://www.meituan.com/meishi/40440922/
文和友龙虾馆,小吃快餐,香洲区桂花南路88号桂花苑1栋一层101铺,3,61,https://www.meituan.com/meishi/185026439/
吉莲有间餐厅,小吃快餐,香洲区岭南路6-206号,4.7,31,https://www.meituan.com/meishi/4589774/
喜多多茶餐厅（湾仔店）,小吃快餐,香洲区湾仔上沙路24号水岸华都商业街内,5,59,https://www.meituan.com/meishi/41550731/
老汉口龙虾生蚝火锅（银桦店）,小吃快餐,香洲区银桦路209号（银桦路交兴业路红绿灯往香洲总站方向100米处）,4.4,72,https://www.meituan.com/meishi/152829246/
一町SNACK（吉大店）,小吃快餐,香洲区吉大景山路156号-B（农业银行斜对面）,4.5,61,https://www.meituan.com/meishi/5424659/
小镇牛杂,小吃快餐,香洲区南屏镇环屏路24号C栋一层A8、A9号商铺,5,58,https://www.meituan.com/meishi/41993295/
亚游牛杂大王（新香洲店）,小吃快餐,香洲区敬业路51号,3,44,https://www.meituan.com/meishi/193477133/
脆皮啤酒烤鸭,小吃快餐,香洲区景山路吉大临时市场内（吉大公交车站附近市场）,5,54,https://www.meituan.com/meishi/42560814/
阿毛捞面,小吃快餐,香洲区南屏镇前河西路333号中信红树湾八栋八号商铺,4.8,75,https://www.meituan.com/meishi/63095793/
达达鸭（吉大店）,小吃快餐,香洲区广东省珠海市香洲区金景大厦景山路156号,0,56,https://www.meituan.com/meishi/1761884737/
南京老鸭粉丝汤,小吃快餐,香洲区兰埔路229号—18号铺,4.6,15,https://www.meituan.com/meishi/41911319/
尊尼比萨（新香洲华润万家店）,小吃快餐,香洲区人民西路710号（人民西路华润万家左侧安富街路口）,4.3,88,https://www.meituan.com/meishi/68437457/
八方牛肚粉,小吃快餐,香洲区创业路心华路303号,3.5,95,https://www.meituan.com/meishi/193442371/
瑞可爷爷ROYE（华发商都店）,小吃快餐,香洲区珠海大道8号华发商都A馆二楼A2068号（百佳超市对面）（手扶电梯处）,3.9,16,https://www.meituan.com/meishi/41236948/
真功夫（万家店）,小吃快餐,香洲区人民西路808号（城市风景时代广场华润万家1楼肯德基旁边）,3.5,56,https://www.meituan.com/meishi/1237489/
厨师咖啡茶餐厅,小吃快餐,香洲区兴国街33号,3.5,61,https://www.meituan.com/meishi/193548424/
古春堂凉茶甜品（狮山店）,小吃快餐,香洲区香洲狮山路76号铺,4,31,https://www.meituan.com/meishi/2396236/
澳门琛情咖喱茶餐厅（夏湾店）,小吃快餐,香洲区夏湾粤华路499号商铺（嘉豪园巴士站往夏湾批发市场走100米左侧）,5,59,https://www.meituan.com/meishi/2214180/
小城念,小吃快餐,香洲区情侣北路3333号,3.5,72,https://www.meituan.com/meishi/1854767026/
蒙自源过桥米线（斗门新民店）,小吃快餐,斗门区井岸镇新民路144号B区,3.9,58,https://www.meituan.com/meishi/1238466/
忆口香香辣小龙虾,小吃快餐,香洲区昌平路69号（华骏大酒店左侧300米，粤华西公交站附近）,3.7,61,https://www.meituan.com/meishi/2514386/
布浆就深夜豆浆（奥园广场店）,小吃快餐,香洲区梅界路（奥园广场一期首层，肯德基商场外围门口旁）,3,44,https://www.meituan.com/meishi/1228162800/
风雅老树咖啡（前山店）,小吃快餐,香洲区前山前山明珠南路1389号（明珠商业广场）,3.3,54,https://www.meituan.com/meishi/1239857/
嘻语小馆,小吃快餐,香洲区金鼎金峰中路73号商铺,4.2,75,https://www.meituan.com/meishi/4047994/
钱记螺蛳粉水饺手抓饼,小吃快餐,香洲区桃园路44号（紫荆中学操场对面）,3.9,56,https://www.meituan.com/meishi/41856451/
彩云传奇过桥米线（云海店）,小吃快餐,香洲区九洲大道东1263号云海酒店旁彩云传奇餐厅,3.7,15,https://www.meituan.com/meishi/40127749/
味千拉面（珠海景山路店）,小吃快餐,香洲区吉大景山路228号国贸购物广场一层n-5号,3.5,88,https://www.meituan.com/meishi/1238837/
茶里斯欧式奶茶铺（横琴店）,小吃快餐,横琴新区横琴新区银行街步行街临时街亭B04号（中国银行旁）,5,95,https://www.meituan.com/meishi/40045870/
蓝西咖啡（二城商业广场店）,小吃快餐,香洲区金鸡路32号二城心作5栋32号（二城广场巴士站旁）,4.1,16,https://www.meituan.com/meishi/5733751/
肯德基（吉大店）,小吃快餐,香洲区吉大景山路免税商场一楼218号,3.5,56,https://www.meituan.com/meishi/1238305/
桂林人桂林米粉,小吃快餐,香洲区拱北岭南路68-1109号（珠海农商银行后门）,4.1,61,https://www.meituan.com/meishi/6879249/
黑色经典长沙臭豆腐,小吃快餐,香洲区南屏镇环屏路商业街DA-13a号商铺,4.3,31,https://www.meituan.com/meishi/5315753/
华富美食大排档,小吃快餐,香洲区粤华路225号《花苑新村11栋》可高德导航华富美食,3.5,59,https://www.meituan.com/meishi/6043655/
必胜客（仁恒店）,小吃快餐,香洲区新香洲星园路3号仁恒星园商业街,4,72,https://www.meituan.com/meishi/1235932/
肯德基（仁恒店）,小吃快餐,香洲区人民西路仁恒星园商业街,4,61,https://www.meituan.com/meishi/1240354/
知味丁肉骨茶（香洲店）,小吃快餐,香洲区海燕路99号（鑫北数码港旁）,3.9,58,https://www.meituan.com/meishi/5436216/
德国坤思特1688-冰淇淋蛋糕店（五洲花城店）,小吃快餐,香洲区兴业路233号（五洲花城商铺）,4.2,44,https://www.meituan.com/meishi/1391674/
